,Position,date,persName,roleName
1213,LEEWARD ISLANDS (ANTIGUA until 1871; until 1959),1868-1873,Sir B.C. Campbell Pine,K.C.M.G.
1214,LEEWARD ISLANDS (ANTIGUA until 1871; until 1959),1873-1874,Sir H. Turner Irving,G.C.M.G.
1215,LEEWARD ISLANDS (ANTIGUA until 1871; until 1959),1875-1881,Sir George Berkeley,K.C.M.G.
1216,LEEWARD ISLANDS (ANTIGUA until 1871; until 1959),1881-1883,Captain Sir John H. Glover,G.C.M.G.
1217,LEEWARD ISLANDS (ANTIGUA until 1871; until 1959),1884-1885,Sir Charles C. Lees,K.C.M.G.
1218,LEEWARD ISLANDS (ANTIGUA until 1871; until 1959),1885-1887,Viscount Gormanston,G.C.M.G.
1219,LEEWARD ISLANDS (ANTIGUA until 1871; until 1959),1888-1895,Sir William F.H. Smith,K.C.M.G.
1220,LEEWARD ISLANDS (ANTIGUA until 1871; until 1959),1895-1901,Sir Francis Fleming,K.C.M.G.
1221,LEEWARD ISLANDS (ANTIGUA until 1871; until 1959),1901-1902,Sir Henry M. Jackson,G.C.M.G.
1222,LEEWARD ISLANDS (ANTIGUA until 1871; until 1959),1902-1904,Lord Strickland,G.C.M.G.
1223,LEEWARD ISLANDS (ANTIGUA until 1871; until 1959),1904-1905,Sir C. Courtenay Knollys,K.C.M.G.
1224,LEEWARD ISLANDS (ANTIGUA until 1871; until 1959),1906-1912,Sir Ernest B. Sweet-Escott,K.C.M.G.
1225,LEEWARD ISLANDS (ANTIGUA until 1871; until 1959),1912-1916,Sir H. Hesketh J. Bell,G.C.M.G.
1226,LEEWARD ISLANDS (ANTIGUA until 1871; until 1959),1916-1921,Sir Edward M. Merewether,"K.C.M.G., K.C.V.O."
1227,LEEWARD ISLANDS (ANTIGUA until 1871; until 1959),1921-1929,"Lieutenant-Colonel the Hon. Sir Eustace E. Twistleton-Wykeham-Fiennes, Bt.",
1228,LEEWARD ISLANDS (ANTIGUA until 1871; until 1959),1929-1936,Lieutenant-Colonel Sir T. Reginald St.Johnston,K.C.M.G.
1229,LEEWARD ISLANDS (ANTIGUA until 1871; until 1959),1936-1941,Sir Gordon J. Lethem,K.C.M.G.
1230,LEEWARD ISLANDS (ANTIGUA until 1871; until 1959),1941-1943,Sir Douglas J. Jardine,"K.C.M.G., O.B.E."
1231,LEEWARD ISLANDS (ANTIGUA until 1871; until 1959),1943-1947,Sir L. Brian Freeston,"K.C.M.G., O.B.E."
1232,LEEWARD ISLANDS (ANTIGUA until 1871; until 1959),1948-1950,Earl Baldwin of Bewdley,
1233,LEEWARD ISLANDS (ANTIGUA until 1871; until 1959),1950-1956,Sir Kenneth W. Blackburne,"G.C.M.G., G.B.E."
1234,LEEWARD ISLANDS (ANTIGUA until 1871; until 1959),1957-1959,Sir Alexander T. Williams,"K.C.M.G., M.B.E."
1235,MALTA (until 1964),1847-1851,Rt. Hon. Richard M. O’Ferrall,
1236,MALTA (until 1964),1851-1858,Major-General Sir William Reid,K.C.B.
1237,MALTA (until 1964),1858-1864,Lieutenant-General Sir John G. Le Marchant,G.C.M.G.
1238,MALTA (until 1964),1864-1865,Lieutenant-General Rt. Hon. Sir Henry K. Storks,G.C.B.
1239,MALTA (until 1964),1867-1872,Field-Marshal Sir Patrick Grant,"G.C.B., G.C.M.G."
1240,MALTA (until 1964),1872-1878,General Sir Charles T. Van Straubenzee,G.C.B.
1241,MALTA (until 1964),1878-1884,General Sir Arthur Borton,"G.C.B., G.C.M.G."
1242,MALTA (until 1964),1884-1888,Field-Marshal Sir J. Lintorn A. Simmons,"G.C.B., G.C.M.G."
1243,MALTA (until 1964),1888-1889,Lieutenant-General Sir Henry D’O. Torrens,K.C.B.
1244,MALTA (until 1964),1890-1893,General Sir Henry A. Smyth,K.C.M.G.
1245,MALTA (until 1964),1894-1899,General Sir Arthur J.L. Fremantle,"G.C.M.G., C.B."
1246,MALTA (until 1964),1899-1903,Field-Marshal Rt. Hon. Lord Grenfell,"G.C.B., G.C.M.G."
1247,MALTA (until 1964),1903-1907,"General Sir Charles Mansfield Clarke, Bt.",G.C.B.
1248,MALTA (until 1964),1907-1909,Lieutenant-General Sir Henry Fane Grant,G.C.B.
1249,MALTA (until 1964),1909-1915,General Sir H.M. Leslie Rundle,"G.C.B., G.C.M.G., G.C.V.O., D.S.O."
1250,MALTA (until 1964),1915-1919,Field-Marshal Lord Methuen,"G.C.B., G.C.M.G., G.C.V.O."
1251,MALTA (until 1964),1919-1924,Field-Marshal Viscount Plumer,"G.C.B., G.C.M.G., G.C.V.O., G.B.E."
1252,MALTA (until 1964),1924-1927,"General Sir Walter N. Congreve, V.C.","K.C.B., M.V.O."
1253,MALTA (until 1964),1927-1931,General Sir John P. Du Cane,G.C.B.
1254,MALTA (until 1964),1931-1937,General Sir David G.M. Campbell,G.C.B.
1255,MALTA (until 1964),1936-1940,General Sir Charles Bonham-Carter,"G.C.B., C.M.G."
1256,MALTA (until 1964),1940-1942,Lieutenant-General Sir William G.S. Dobbie,"G.C.M.G., K.C.B., D.S.O."
1257,MALTA (until 1964),1942-1944,"Field-Marshal Viscount Gort, V.C.","G.C.B., C.B.E., D.S.O., M.V.O., M.C."
1258,MALTA (until 1964),1944-1946,Lieutenant-General Sir Edmond C.A. Schreiber,K.C.B.
1259,MALTA (until 1964),1946-1949,Lord Douglas of Barloch,K.C.M.G.
1260,MALTA (until 1964),1940-1953,Sir Gerald H. Creasy,"K.C.M.G., O.B.E."
1261,MALTA (until 1964),1953-1959,Major-General Sir Robert E. Laycock,"K.C.M.G., C.B."
1262,MALTA (until 1964),1959-1962,Admiral Sir Guy Grantham,"G.C.B., C.B.E., D.S.O."
1263,MALTA (until 1964),1962-1964,Sir Maurice H. Dorman,"G.C.M.G., G.C.V.O."
1264,MALTA (until 1964),1847-1855,Henry Lushington,
1265,MALTA (until 1964),1855-1884,Sir E. Victor L. Houlton,G.C.M.G.
1266,MALTA (until 1964),1884-1889,Hon. Sir Walter F. Hely-Hutchinson,G.C.M.G.
1267,MALTA (until 1964),1889-1902,Lord Strickland,G.C.M.G.
1268,MALTA (until 1964),1902-1911,Sir Edward M. Merewether,"K.C.M.G., K.C.V.O."
1269,MALTA (until 1964),1911-1914,Major Sir John E. Clauson,"K.C.M.G., C.V.O."
1270,MALTA (until 1964),1914-1916,Sir Horace A. Byatt,G.C.M.G.
1271,MALTA (until 1964),1917-1925,Sir William C.F. Robertson,K.C.M.G.
1272,MALTA (until 1964),1925-1930,Sir Thomas A. Vans Best,"K.C.M.G., K.B.E."
1273,MALTA (until 1964),1930-1938,Sir Harry C. Luke,K.C.M.G.
1274,MALTA (until 1964),1938-1940,Sir John A. Hunter,K.C.M.G.
1275,MALTA (until 1964),1940-1943,"Sir Edward St.J. Jackson, K.C.M.G",K.B.E.
1276,MALTA (until 1964),1943-1952,Rt. Hon. Sir David C. Campbell,"K.B.E., C.M.G."
1277,MALTA (until 1964),1953-1959,Trafford Smith,C.M.G.
1278,MALTA (until 1964),1959-1962,Archibald Campbell,C.M.G.
1279,MAURITIUS (until 1968),1849-1850,Sir George W. Anderson,K.C.B.
1280,MAURITIUS (until 1968),1851-1857,Sir Janies M. Higginson,K.C.B.
1281,MAURITIUS (until 1968),1857-1863,Sir William Stevenson,K.C.B.
1282,MAURITIUS (until 1968),1863-1870,Sir Henry Barkly,"G.C.M.G., K.C.B."
1283,MAURITIUS (until 1968),1871-1874,Lord Stanmore,G.C.M.G.
1284,MAURITIUS (until 1968),1874-1878,Lieutenant-General Sir Arthur P. Phayre,"G.C.M.G., K.C.S.I., C.B."
1285,MAURITIUS (until 1968),1879-1880,Rt. Hon. Sir George F. Bowen,G.C.M.G.
1286,MAURITIUS (until 1968),1880-1883,Sir Frederick N. Broome,K.C.M.G.
1287,MAURITIUS (until 1968),1883-1889,Sir John Pope-Hennessy,K.C.M.G.
1288,MAURITIUS (until 1968),1889-1892,Sir Charles C. Lees,K.C.M.G.
1289,MAURITIUS (until 1968),1892-1897,Sir Hubert E.J. Jerningham,K.C.M.G.
1290,MAURITIUS (until 1968),1897-1903,Sir Charles Bruce,G.C.M.G.
1291,MAURITIUS (until 1968),1904-1911,Sir Charles C. Boyle,K.C.M.G.
1292,MAURITIUS (until 1968),1911-1916,Lieutenant-Colonel Sir John R. Chancellor,"G.C.M.G., G.C.V.O., G.B.E., D.S.O."
1293,MAURITIUS (until 1968),1916-1924,Sir H. Hesketh J. Bell,G.C.M.G.
1294,MAURITIUS (until 1968),1925-1929,Sir Herbert J. Read,"G.C.M.G., C.B."
1295,MAURITIUS (until 1968),1930-1937,Sir Wilfrid E.F. Jackson,G.C.M.G.
1296,MAURITIUS (until 1968),1937-1942,Captain the Hon. Sir Bede E.H. Clifford,"G.C.M.G., C.B."
1297,MAURITIUS (until 1968),1942-1948,Sir H.C. Donald Mackenzie-Kennedy,K.C.M.G.
1298,MAURITIUS (until 1968),1949-1954,Sir Hilary R.R. Blood,"G.B.E., K.C.M.G."
1299,MAURITIUS (until 1968),1954-1959,Sir Robert Scott,K.C.M.G.
1300,MAURITIUS (until 1968),1959-1962,Sir Colville M. Deverell,"G.B.E., K.C.M.G., C.V.O."
1301,MAURITIUS (until 1968),1962-1968,Sir John S. Rennie,"G.C.M.G., O.B.E."
1302,MAURITIUS (until 1968),1849-1857,Charles J. Bayley,
1303,MAURITIUS (until 1968),1857-1859,Humphry Sandwith,C.B.
1304,MAURITIUS (until 1968),1860-1868,Felix Bedingfeld,C.M.G.
1305,MAURITIUS (until 1968),1868-1878,Sir Edward Newton,K.C.M.G.
1306,MAURITIUS (until 1968),1878-1882,Sir Frederick N. Broome,K.C.M.G.
1307,MAURITIUS (until 1968),1882-1885,Sir Charles Bruce,G.C.M.G.
1308,MAURITIUS (until 1968),1885-1887,C.D. Clifford Lloyd,
1309,MAURITIUS (until 1968),1887-1888,Sir Francis Fleming,K.C.M.G.
1310,MAURITIUS (until 1968),1889-1893,Sir Hubert E.H. Jerningham,K.C.M.G.
1311,MAURITIUS (until 1968),1893-1897,Sir Charles A. King-Harman,K.C.M.G.
1312,MAURITIUS (until 1968),1897-1898,Sir George R. Le Hunte,K.C.M.G.
1313,MAURITIUS (until 1968),1898-1910,Commander Sir Graham J. Bower,K.C.M.G.
1314,MAURITIUS (until 1968),1910-1913,Sir George Smith,K.C.M.G.
1315,MAURITIUS (until 1968),1913-1920,Sir John Middleton,"K.C.M.G., K.B.E."
1316,MAURITIUS (until 1968),1920-1923,Sir Edward B. Denham,"G.C.M.G., K.B.E."
1317,MAURITIUS (until 1968),1923-1932,Sir Edward A. Grannum,C.M.G.
1318,MAURITIUS (until 1968),1932-1939,Edward W. Evans,C.M.G.
1319,MAURITIUS (until 1968),1939-1948,Sydney Moody,"C.M.G., O.B.E."
1320,MAURITIUS (until 1968),1948-1953,Sir James D. Harford,"K.B.E., C.M.G."
1321,MAURITIUS (until 1968),1953-1960,Robert Newton,C.M.G.
1322,MAURITIUS (until 1968),1960-1968,Thomas D. Vickers,C.M.G.
1323,Colonial Secretary (Chief Secretary from 1961 until 1967; Deputy Governor from 1967),1849-1857,Charles J. Bayley,
1324,Colonial Secretary (Chief Secretary from 1961 until 1967; Deputy Governor from 1967),1857-1859,Humphry Sandwith,C.B.
1325,Colonial Secretary (Chief Secretary from 1961 until 1967; Deputy Governor from 1967),1860-1868,Felix Bedingfeld,C.M.G.
1326,Colonial Secretary (Chief Secretary from 1961 until 1967; Deputy Governor from 1967),1868-1878,Sir Edward Newton,K.C.M.G.
1327,Colonial Secretary (Chief Secretary from 1961 until 1967; Deputy Governor from 1967),1878-1882,Sir Frederick N. Broome,K.C.M.G.
1328,Colonial Secretary (Chief Secretary from 1961 until 1967; Deputy Governor from 1967),1882-1885,Sir Charles Bruce,G.C.M.G.
1329,Colonial Secretary (Chief Secretary from 1961 until 1967; Deputy Governor from 1967),1885-1887,C.D. Clifford Lloyd,
1330,Colonial Secretary (Chief Secretary from 1961 until 1967; Deputy Governor from 1967),1887-1888,Sir Francis Fleming,K.C.M.G.
1331,Colonial Secretary (Chief Secretary from 1961 until 1967; Deputy Governor from 1967),1889-1893,Sir Hubert E.H. Jerningham,K.C.M.G.
1332,Colonial Secretary (Chief Secretary from 1961 until 1967; Deputy Governor from 1967),1893-1897,Sir Charles A. King-Harman,K.C.M.G.
1333,Colonial Secretary (Chief Secretary from 1961 until 1967; Deputy Governor from 1967),1897-1898,Sir George R. Le Hunte,K.C.M.G.
1334,Colonial Secretary (Chief Secretary from 1961 until 1967; Deputy Governor from 1967),1898-1910,Commander Sir Graham J. Bower,K.C.M.G.
1335,Colonial Secretary (Chief Secretary from 1961 until 1967; Deputy Governor from 1967),1910-1913,Sir George Smith,K.C.M.G.
1336,Colonial Secretary (Chief Secretary from 1961 until 1967; Deputy Governor from 1967),1913-1920,Sir John Middleton,"K.C.M.G., K.B.E."
1337,Colonial Secretary (Chief Secretary from 1961 until 1967; Deputy Governor from 1967),1920-1923,Sir Edward B. Denham,"G.C.M.G., K.B.E."
1338,Colonial Secretary (Chief Secretary from 1961 until 1967; Deputy Governor from 1967),1923-1932,Sir Edward A. Grannum,C.M.G.
1339,Colonial Secretary (Chief Secretary from 1961 until 1967; Deputy Governor from 1967),1932-1939,Edward W. Evans,C.M.G.
1340,Colonial Secretary (Chief Secretary from 1961 until 1967; Deputy Governor from 1967),1939-1948,Sydney Moody,"C.M.G., O.B.E."
1341,Colonial Secretary (Chief Secretary from 1961 until 1967; Deputy Governor from 1967),1948-1953,Sir James D. Harford,"K.B.E., C.M.G."
1342,Colonial Secretary (Chief Secretary from 1961 until 1967; Deputy Governor from 1967),1953-1960,Robert Newton,C.M.G.
1343,Colonial Secretary (Chief Secretary from 1961 until 1967; Deputy Governor from 1967),1960-1968,Thomas D. Vickers,C.M.G.
1344,MONTSERRAT (from 1971),1971-1974,Willoughby H. Thompson,"C.M.G., C.B.E."
1345,MONTSERRAT (from 1971),1974-1976,Norman D. Matthews,O.B.E.
1346,MONTSERRAT (from 1971),1977-1980,G. Wyn Jones,C.B.E.
1347,MONTSERRAT (from 1971),1980-1985,David K.H. Dale,C.B.E.
1348,MONTSERRAT (from 1971),1985-1987,Arthur C. Watson,C.M.G.
1349,MONTSERRAT (from 1971),1987-1990,Christopher J. Turner,C.B.E.
1350,MONTSERRAT (from 1971),1990-1993,David G.P. Taylor,C.B.E.
1351,MONTSERRAT (from 1971),1993-1997,Francis J. Savage,"C.M.G., L.V.O., O.B.E."
1352,MONTSERRAT (from 1971),1997-2001,Anthony J. Abbott,"C.M.G., O.B.E."
1353,MONTSERRAT (from 1971),2001-2004,Anthony J. Longrigg,C.M.G.
1354,MONTSERRAT (from 1971),2004-2007,Deborah E.V. Barnes Jones,
1355,MONTSERRAT (from 1971),2007-2011,Peter A. Waterworth,
1356,MONTSERRAT (from 1971),2011-2015,Adrian D. Davis,
1357,MONTSERRAT (from 1971),2015-2018,Elizabeth A. Carriere,O.B.E.
1358,MONTSERRAT (from 1971),2018-,Andrew J. Pearce,O.B.E.
1359,NEWFOUNDLAND (until 1949),1847-1852,Lieutenant-General Sir John G. Le Marchant,G.C.M.G.
1360,NEWFOUNDLAND (until 1949),1852-1855,Ker Baillie-Hamilton,C.B.
1361,NEWFOUNDLAND (until 1949),1855-1857,Sir Charles H. Darling,K.C.B.
1362,NEWFOUNDLAND (until 1949),1857-1864,Sir Alexander Bannerman,
1363,NEWFOUNDLAND (until 1949),1864-1869,Sir Anthony Musgrave,K.C.M.G.
1364,NEWFOUNDLAND (until 1949),1869-1876,Sir Stephen J. Hill,"K.C.M.G., C.B."
1365,NEWFOUNDLAND (until 1949),1876-1881,Captain Sir John H. Glover,G.C.M.G.
1366,NEWFOUNDLAND (until 1949),1881-1883,Colonel Sir Henry B.F. Maxse,K.C.M.G.
1367,NEWFOUNDLAND (until 1949),1883-1885,Captain Sir John H. Glover,G.C.M.G.
1368,NEWFOUNDLAND (until 1949),1886-1887,Sir G. William Des Voeux,G.C.M.G.
1369,NEWFOUNDLAND (until 1949),1887-1889,Sir Henry A. Blake,G.C.M.G.
1370,NEWFOUNDLAND (until 1949),1889-1895,Lieutenant-Colonel Sir J. Terence N. O’Brien,K.C.M.G.
1371,NEWFOUNDLAND (until 1949),1895-1898,Sir Herbert H. Murray,K.C.B.
1372,NEWFOUNDLAND (until 1949),1898-1901,Sir Henry E. McCallum,G.C.M.G.
1373,NEWFOUNDLAND (until 1949),1901-1904,Sir C. Cavendish Boyle,K.C.M.G.
1374,NEWFOUNDLAND (until 1949),1904-1909,Rt. Hon. Sir William MacGregor,"G.C.M.G., C.B."
1375,NEWFOUNDLAND (until 1949),1909-1913,Sir Ralph C. Williams,K.C.M.G.
1376,NEWFOUNDLAND (until 1949),1913-1917,Sir Walter E. Davidson,K.C.M.G.
1377,NEWFOUNDLAND (until 1949),1917-1922,Sir Charles A. Harris,"K.C.M.G., C.B., C.V.O."
1378,NEWFOUNDLAND (until 1949),1922-1928,Sir William L. Allardyce,G.C.M.G.
1379,NEWFOUNDLAND (until 1949),1928-1932,Sir John Middleton,"K.C.M.G., K.B.E."
1380,NEWFOUNDLAND (until 1949),1932-1936,Admiral Sir D. Murray Anderson,"K.C.B., K.C.M.G."
1381,NEWFOUNDLAND (until 1949),1936-1946,Vice-Admiral Sir Humphrey T. Walwyn,"K.C.S.I., K.C.M.G., C.B., D.S.O."
1382,NEWFOUNDLAND (until 1949),1946-1949,Rt. Hon. Lord Macdonald of Gwaenysgor,K.C.M.G.
1383,NEW ZEALAND (until 1917; Governor-General from 1917),1845-1854,Sir George Grey,K.C.B.
1384,NEW ZEALAND (until 1917; Governor-General from 1917),1855-1861,Colonel Sir Thomas R. Gore Browne,"K.C.M.G., C.B."
1385,NEW ZEALAND (until 1917; Governor-General from 1917),1861-1868,Sir George Grey,K.C.B.
1386,NEW ZEALAND (until 1917; Governor-General from 1917),1868-1873,Rt. Hon. Sir George F. Bowen,G.C.M.G.
1387,NEW ZEALAND (until 1917; Governor-General from 1917),1873-1874,"Rt. Hon. Sir James Fergusson, Bt.",G.C.S.I.
1388,NEW ZEALAND (until 1917; Governor-General from 1917),1874-1879,Rt. Hon. Marquess of Normanby,"G.C.B., G.C.M.G."
1389,NEW ZEALAND (until 1917; Governor-General from 1917),1879-1880,Rt. Hon. Lord Rosmead,G.C.M.G.
1390,NEW ZEALAND (until 1917; Governor-General from 1917),1880-1882,Lord Stanmore,G.C.M.G.
1391,NEW ZEALAND (until 1917; Governor-General from 1917),1883-1889,Lieutenant-General Sir William F.D. Jervois,G.C.M.G.
1392,NEW ZEALAND (until 1917; Governor-General from 1917),1889-1892,Rt. Hon. Earl of Onslow,G.C.M.G.
1393,NEW ZEALAND (until 1917; Governor-General from 1917),1892-1897,Earl of Glasgow,G.C.M.G.
1394,NEW ZEALAND (until 1917; Governor-General from 1917),1897-1904,Rt. Hon. Earl of Ranfurly,G.C.M.G.
1395,NEW ZEALAND (until 1917; Governor-General from 1917),1904-1910,Lord Plunket,"G.C.M.G., K.C.V.O., K.B.E."
1396,NEW ZEALAND (until 1917; Governor-General from 1917),1910-1912,Rt. Hon. Lord Islington,"G.C.M.G., G.B.E., D.S.O."
1397,NEW ZEALAND (until 1917; Governor-General from 1917),1912-1920,Rt. Hon. Earl of Liverpool,"G.C.B., G.C.M.G., G.B.E."
1398,NEW ZEALAND (until 1917; Governor-General from 1917),1920-1924,Admiral of the Fleet Earl Jellicoe,"G.C.B., O.M., G.C.V.O."
1399,NEW ZEALAND (until 1917; Governor-General from 1917),1924-1930,"General Sir Charles Fergusson, Bt.","G.C.B., G.C.M.G., D.S.O., M.V.O."
1400,NEW ZEALAND (until 1917; Governor-General from 1917),1930-1935,Rt. Hon. Viscount Bledisloe,"G.C.M.G., K.B.E."
1401,NEW ZEALAND (until 1917; Governor-General from 1917),1935-1941,Rt. Hon. Viscount Galway,"G.C.M.G., D.S.O., O.B.E."
1402,NEW ZEALAND (until 1917; Governor-General from 1917),1941-1946,Marshal of the Royal Air Force Lord Newall,"G.C.B., O.M., G.C.M.G., C.B.E."
1403,NEW ZEALAND (until 1917; Governor-General from 1917),1946-1952,"Lieutenant-General Lord Freyberg, V.C.","G.C.M.G., K.C.B., K.B.E., D.S.O."
1404,NEW ZEALAND (until 1917; Governor-General from 1917),1952-1957,Lieutenant-General Lord Norrie,"G.C.M.G., G.C.V.O., C.B., D.S.O., M.C."
1405,NEW ZEALAND (until 1917; Governor-General from 1917),1957-1962,Rt. Hon. Viscount Cobham,"K.G., G.C.M.G., G.C.V.O."
1406,NEW ZEALAND (until 1917; Governor-General from 1917),1962-1967,Brigadier Lord Ballantrae,"K.T., G.C.M.G., G.C.V.O., D.S.O., O.B.E."
1407,NEW ZEALAND (until 1917; Governor-General from 1917),1967-1972,Lord Porritt,"G.C.M.G., G.C.V.O., C.B.E."
1408,NEW ZEALAND (until 1917; Governor-General from 1917),1972-1977,Sir E. Denis Blundell,"G.C.M.G., G.C.V.O., K.B.E."
1409,NEW ZEALAND (until 1917; Governor-General from 1917),1977-1980,Rt. Hon. Sir Keith J. Holyoake,"K.G., G.C.M.G., C.H."
1410,NEW ZEALAND (until 1917; Governor-General from 1917),1980-1985,Sir David S. Beattie,"G.C.M.G., G.C.V.O."
1411,NEW ZEALAND (until 1917; Governor-General from 1917),1985-1990,Rt. Rev. Sir Paul A. Reeves,"G.C.M.G., G.C.V.O."
1412,NEW ZEALAND (until 1917; Governor-General from 1917),1990-1996,Dame Catherine A. Tizard,"G.C.M.G., G.C.V.O., D.B.E."
1413,NEW ZEALAND (until 1917; Governor-General from 1917),1996-2001,Sir Michael Hardie Boys,G.C.M.G.
1414,NEW ZEALAND (until 1917; Governor-General from 1917),2001-2006,Dame Silvia R. Cartwright,D.B.E.
1415,NEW ZEALAND (until 1917; Governor-General from 1917),2006-2011,Sir Anand Satyanand,
1416,NEW ZEALAND (until 1917; Governor-General from 1917),2011-,Lieutenant-General Sir Jeremiah Mateparae,
1417,NIGERIA (from 1914 until 1954),1914-1919,Rt. Hon. Lord Lugard,"G.C.M.G., C.B., D.S.O."
1418,NIGERIA (from 1914 until 1954),1919-1925,Sir Hugh C. Clifford,"G.C.M.G., G.B.E."
1419,NIGERIA (from 1914 until 1954),1925-1931,Sir Graeme Thomson,"G.C.M.G., K.C.B."
1420,NIGERIA (from 1914 until 1954),1931-1935,Sir Donald C. Cameron,"G.C.M.G., K.B.E."
1421,NIGERIA (from 1914 until 1954),1935-1943,Sir Bernard H. Bourdillon,"G.C.M.G., K.B.E."
1422,NIGERIA (from 1914 until 1954),1943-1948,Lord Milverton,G.C.M.G.
1423,NIGERIA (from 1914 until 1954),1948-1954,Sir John S. Macpherson,G.C.M.G.
1424,NIGERIA (from 1914 until 1954),1914-1924,Sir Donald C. Cameron,"G.C.M.G., K.B.E."
1425,NIGERIA (from 1914 until 1954),1924-1930,Sir Frank M. Baddeley,"K.B.E., C.M.G."
1426,NIGERIA (from 1914 until 1954),1930-1934,George Hemmant,C.M.G.
1427,NIGERIA (from 1914 until 1954),1934-1938,Sir John A. Maybin,K.C.M.G.
1428,NIGERIA (from 1914 until 1954),1938-1941,Sir Charles C. Woolley,"G.B.E., K.C.M.G., M.C."
1429,NIGERIA (from 1914 until 1954),1941-1944,Sir Alexander W.G.H. Grantham,G.C.M.G.
1430,NIGERIA (from 1914 until 1954),1945-1947,Sir George Beresford-Stooke,K.C.M.G.
1431,NIGERIA (from 1914 until 1954),1947-1951,Rt. Hon. Lord Caradon,"G.C.M.G., K.C.V.O., O.B.E."
1432,NIGERIA (from 1914 until 1954),1951-1954,Sir Arthur E.T. Benson,G.C.M.G.
1433,NIGERIA (from 1914 until 1954),1955-1957,Lord Grey of Naunton,"G.C.M.G., G.C.V.O., O.B.E."
1434,"Chief Secretary, Nigeria (Colonial Secretary until 1921)",1914-1924,Sir Donald C. Cameron,"G.C.M.G., K.B.E."
1435,"Chief Secretary, Nigeria (Colonial Secretary until 1921)",1924-1930,Sir Frank M. Baddeley,"K.B.E., C.M.G."
1436,"Chief Secretary, Nigeria (Colonial Secretary until 1921)",1930-1934,George Hemmant,C.M.G.
1437,"Chief Secretary, Nigeria (Colonial Secretary until 1921)",1934-1938,Sir John A. Maybin,K.C.M.G.
1438,"Chief Secretary, Nigeria (Colonial Secretary until 1921)",1938-1941,Sir Charles C. Woolley,"G.B.E., K.C.M.G., M.C."
1439,"Chief Secretary, Nigeria (Colonial Secretary until 1921)",1941-1944,Sir Alexander W.G.H. Grantham,G.C.M.G.
1440,"Chief Secretary, Nigeria (Colonial Secretary until 1921)",1945-1947,Sir George Beresford-Stooke,K.C.M.G.
1441,"Chief Secretary, Nigeria (Colonial Secretary until 1921)",1947-1951,Rt. Hon. Lord Caradon,"G.C.M.G., K.C.V.O., O.B.E."
1442,"Chief Secretary, Nigeria (Colonial Secretary until 1921)",1951-1954,Sir Arthur E.T. Benson,G.C.M.G.
1443,"Chief Secretary, Nigeria (Colonial Secretary until 1921)",1955-1957,Lord Grey of Naunton,"G.C.M.G., G.C.V.O., O.B.E."
1444,LAGOS (from 1886 until 1906),1886-1891,Sir Cornelius A. Moloney,K.C.M.G.
1445,LAGOS (from 1886 until 1906),1891-1897,Sir Gilbert T. Cater,K.C.M.G.
1446,LAGOS (from 1886 until 1906),1897-1899,Sir Henry E. McCallum,K.C.M.G.
1447,LAGOS (from 1886 until 1906),1899-1904,Rt. Hon. Sir William MacGregor,G.C.M.G.
1448,LAGOS (from 1886 until 1906),1904-1906,Sir Walter Egerton,K.C.M.G.
1449,EASTERN NIGERIA (from 1954 until 1960),1954-1956,Sir C. John Pleass,"K.C.M.G., K.C.V.O., K.B.E."
1450,EASTERN NIGERIA (from 1954 until 1960),1957-1960,Sir Robert de S. Stapledon,"K.C.M.G., C.B.E."
1451,NORTHERN NIGERIA (from 1908 until 1914 and from 1954 until 1957),1908-1909,Colonel Sir E. Percy C. Girouard,"K.C.M.G., D.S.O."
1452,NORTHERN NIGERIA (from 1908 until 1914 and from 1954 until 1957),1909-1912,Sir H. Hesketh J. Bell,G.C.M.G.
1453,NORTHERN NIGERIA (from 1908 until 1914 and from 1954 until 1957),1912-1914,Rt. Hon. Lord Lugard,"G.C.M.G., C.B., D.S.O."
1454,NORTHERN NIGERIA (from 1908 until 1914 and from 1954 until 1957),1954-1957,Sir Bryan E. Sharwood-Smith,"K.C.M.G., K.C.V.O., K.B.E."
1455,NORTHERN NIGERIA (from 1908 until 1914 and from 1954 until 1957),1957-1960,Sir Gawain W. Bell,"K.C.M.G., C.B.E."
1456,SOUTHERN NIGERIA (from 1906 until 1914),1906-1912,Sir Walter Egerton,K.C.M.G.
1457,SOUTHERN NIGERIA (from 1906 until 1914),1912-1914,Rt. Hon. Lord Lugard,"G.C.M.G., C.B., D.S.O."
1458,WESTERN NIGERIA (from 1954 until 1960),1954-1960,Sir John D. Rankine,"K.C.M.G., K.C.V.O."
1459,NORTH BORNEO (until 1963),1900-1901,Sir Hugh C. Clifford,"G.C.M.G., G.B.E."
1460,NORTH BORNEO (until 1963),1901-1903,Sir Ernest W. Birch,K.C.M.G.
1461,NORTH BORNEO (until 1963),1903-1911,Edward P. Gueritz,
1462,NORTH BORNEO (until 1963),1911-1912,Francis R. Ellis,
1463,NORTH BORNEO (until 1963),1912,James Scott Mason,
1464,NORTH BORNEO (until 1963),1913-1915,Cecil W.C. Parr,"C.M.G., O.B.E."
1465,NORTH BORNEO (until 1963),1915-1922,Aylmer C. Pearson,
1466,NORTH BORNEO (until 1963),1922-1925,Major-General Sir William H. Rycroft,"K.C.B., K.C.M.G."
1467,NORTH BORNEO (until 1963),1925-1926,Aylmer C. Pearson,
1468,NORTH BORNEO (until 1963),1926-1929,John L. Humphreys,"C.M.G., C.B.E."
1469,NORTH BORNEO (until 1963),1930-1933,Lord Milverton,G.C.M.G.
1470,NORTH BORNEO (until 1963),1934-1937,Sir Douglas J. Jardine,"K.C.M.G., O.B.E."
1471,NORTH BORNEO (until 1963),1937-1942,Sir C. Robert Smith,"K.B.E., C.M.G."
1472,NORTH BORNEO (until 1963),1945-1946,Sir C. Robert Smith,"K.B.E., C.M.G."
1473,NORTH BORNEO (until 1963),1946-1949,Lord Twining,"G.C.M.G., M.B.E."
1474,NORTH BORNEO (until 1963),1949-1954,Major-General Sir H. Ralph Hone,"K.C.M.G., K.B.E., M.C."
1475,NORTH BORNEO (until 1963),1954-1959,Sir Roland E. Turnbull,K.C.M.G.
1476,NORTH BORNEO (until 1963),1959-1963,Sir William A.C. Goode,G.C.M.G.
1477,NORTH BORNEO (until 1963),1946-1953,James Calder,C.M.G.
1478,NORTH BORNEO (until 1963),1953-1956,Bryan J. O’Brien,C.M.G.
1479,NORTH BORNEO (until 1963),1956-1963,Robert N. Turner,C.M.G.
1480,Chief Secretary,1920-1922,Brigadier-General Sir Wyndham H. Deedes,"C.M.G., D.S.O."
1481,Chief Secretary,1922-1925,Brigadier-General Sir Gilbert F. Clayton,"K.C.M.G., K.B.E."
1482,Chief Secretary,1925-1928,Lieutenant-Colonel Sir G. Stewart Symes,"G.B.E., K.C.M.G., D.S.O."
1483,Chief Secretary,1928-1930,Sir Harry C. Luke,K.C.M.G.
1484,Chief Secretary,1930-1933,Sir Mark A. Young,G.C.M.G.
1485,Chief Secretary,1933-1937,Sir John H. Hall,"G.C.M.G., D.S.O., O.B.E."
1486,Chief Secretary,1937-1939,Sir William D. Battershill,K.C.M.G.
1487,Chief Secretary,1939-1943,Sir John S. Macpherson,G.C.M.G.
1488,Chief Secretary,1943-1946,Sir John V.W. Shaw,K.C.M.G.
1489,Chief Secretary,1946-1948,Sir Henry L.G. Gurney,K.C.M.G.
1490,NORTHERN RHODESIA (from 1924 until 1964),1924-1927,Sir Herbert J. Stanley,G.C.M.G.
1491,NORTHERN RHODESIA (from 1924 until 1964),1927-1932,Sir James C. Maxwell,"K.C.M.G., K.B.E."
1492,NORTHERN RHODESIA (from 1924 until 1964),1932-1934,Sir Ronald H.A. Storrs,"K.C.M.G., C.B.E."
1493,NORTHERN RHODESIA (from 1924 until 1964),1934-1938,Major Sir Hubert W. Young,"K.C.M.G., D.S.O."
1494,NORTHERN RHODESIA (from 1924 until 1964),1938-1941,Sir John A. Maybin,K.C.M.G.
1495,NORTHERN RHODESIA (from 1924 until 1964),1941-1947,Sir E. John Waddington,"G.B.E., K.C.M.G., K.C.V.O."
1496,NORTHERN RHODESIA (from 1924 until 1964),1947-1954,Sir Gilbert McC. Rennie,"G.B.E., K.C.M.G., M.C."
1497,NORTHERN RHODESIA (from 1924 until 1964),1954-1959,Sir Arthur E.T. Benson,G.C.M.G.
1498,NORTHERN RHODESIA (from 1924 until 1964),1959-1964,Sir Evelyn D. Hone,"G.C.M.G., C.V.O., O.B.E."
1499,NORTHERN RHODESIA (from 1924 until 1964),1924-1927,Sir Richard A.J. Goode,"C.M.G., C.B.E."
1500,NORTHERN RHODESIA (from 1924 until 1964),1927-1930,Sir Geoffry A.S. Northcote,K.C.M.G.
1501,NORTHERN RHODESIA (from 1924 until 1964),1930-1934,Sir H.C. Donald C. Mackenzie-Kennedy,K.C.M.G.
1502,NORTHERN RHODESIA (from 1924 until 1964),1934-1937,Hon. Sir Charles C. F. Dundas,"K.C.M.G., O.B.E."
1503,NORTHERN RHODESIA (from 1924 until 1964),1937-1942,Sir William M. Logan,"K.B.E., C.M.G."
