,Position,date,persName,roleName
624,CANADA: Governor-General,1935-1940,Rt. Hon. Lord Tweedsmuir,"G.C.M.G., G.C.V.O., C.H."
625,CANADA: Governor-General,1940-1946,Major-General Rt. Hon. Earl of Athlone,"K.G., G.C.B., G.C.M.G., G.C.V.O., D.S.O."
626,CANADA: Governor-General,1946-1952,Field-Marshal Rt. Hon. Earl Alexander of Tunis,"K.G., G.C.B., O.M., G.C.M.G., C.S.I., D.S.O., M.C."
627,CANADA: Governor-General,1952-1959,Rt. Hon. C. Vincent Massey,C.H.
628,CANADA: Governor-General,1959-1967,Major-General Rt. Hon. Georges-Phileas Vanier,"D.S.O., M.C."
629,CANADA: Governor-General,1967-1974,Rt. Hon. D. Roland Michener,
630,CANADA: Governor-General,1974-1979,Rt. Hon. Jules Leger,
631,CANADA: Governor-General,1979-1984,Rt. Hon. Edward R. Schreyer,
632,CANADA: Governor-General,1984-1990,Rt. Hon. Jeanne M. Sauve,
633,CANADA: Governor-General,1990-1995,Rt. Hon. Ramon J. Hnatyshyn,
634,CANADA: Governor-General,1995-1999,Rt. Hon. Romeo-Adrien LeBlanc,
635,CANADA: Governor-General,1999-2005,Rt. Hon. Adrienne L. Clarkson,
636,CANADA: Governor-General,2005-2010,Rt. Hon. Michaelle Jean,
637,CANADA: Governor-General,2010-,Rt. Hon. David L. Johnston,
638,CAYMAN ISLANDS (since 1971),1971,Athelstan C.E. Long,"C.M.G., C.B.E."
639,CAYMAN ISLANDS (since 1971),1971-1974,Kenneth R. Crook,C.M.G.
640,CAYMAN ISLANDS (since 1971),1974-1981,Thomas Russell,"C.M.G., C.B.E."
641,CAYMAN ISLANDS (since 1971),1982-1987,G. Peter Lloyd,"C.M.G., C.V.O."
642,CAYMAN ISLANDS (since 1971),1987-1992,Alan J. Scott,"C.V.O., C.B.E."
643,CAYMAN ISLANDS (since 1971),1992-1995,Michael E.J. Gore,"C.V.O., C.B.E."
644,CAYMAN ISLANDS (since 1971),1995-1999,John W. Owen,"C.M.G., M.B.E."
645,CAYMAN ISLANDS (since 1971),1999-2002,Peter J. Smith,C.B.E.
646,CAYMAN ISLANDS (since 1971),2002-2005,Bruce H. Dinwiddy,C.M.G.
647,CAYMAN ISLANDS (since 1971),2005-2009,Stuart D.M. Jack,C.V.O.
648,CAYMAN ISLANDS (since 1971),2010-2013,Duncan J.R. Taylor,C.B.E.
649,CAYMAN ISLANDS (since 1971),2013-2018,Helen Kilpatrick,C.B.
650,CAYMAN ISLANDS (since 1971),2018-,Anwar B. Choudhury,
651,CEYLON (until 1948),1847-1850,Viscount Torrington,
652,CEYLON (until 1948),1850-1855,Sir George W. Anderson,K.C.B.
653,CEYLON (until 1948),1855-1860,Sir Henry G. Ward,G.C.M.G.
654,CEYLON (until 1948),1860-1863,Sir Charles J. MacCarthy,
655,CEYLON (until 1948),1865-1872,Rt. Hon. Lord Rosmead,G.C.M.G.
656,CEYLON (until 1948),1872-1877,Rt. Hon. Sir William H. Gregory,
657,CEYLON (until 1948),1876-1883,Sir James R. Longden,G.C.M.G.
658,CEYLON (until 1948),1883-1890,Lord Stanmore,G.C.M.G.
659,CEYLON (until 1948),1890-1895,Sir Arthur E. Havelock,"G.C.S.I., G.C.M.G., G.C.I.E."
660,CEYLON (until 1948),1896-1903,Rt. Hon. Sir J. West Ridgeway,"G.C.B., G.C.M.G., K.C.S.I."
661,CEYLON (until 1948),1903-1907,Sir Henry A. Blake,G.C.M.G.
662,CEYLON (until 1948),1907-1913,Colonel Sir Henry E. McCallum,G.C.M.G.
663,CEYLON (until 1948),1913-1915,Rt. Hon. Lord Chalmers,G.C.B.
664,CEYLON (until 1948),1916-1918,Sir John Anderson,"G.C.M.G., K.C.B."
665,CEYLON (until 1948),1918-1925,Brigadier-General Sir William H. Manning,"G.C.M.G., K.B.E., C.B."
666,CEYLON (until 1948),1925-1927,Sir Hugh C. Clifford,"G.C.M.G., G.B.E."
667,CEYLON (until 1948),1927-1930,Sir Herbert J. Stanley,G.C.M.G.
668,CEYLON (until 1948),1930-1933,Sir Graeme Thomson,"G.C.M.G., K.C.B."
669,CEYLON (until 1948),1933-1937,Sir R. Edward Stubbs,G.C.M.G.
670,CEYLON (until 1948),1937-1944,Sir Andrew W. Caldecott,"G.C.M.G., K.B.E."
671,CEYLON (until 1948),1944-1948,Sir Henry M.-M. Moore,G.C.M.G.
672,CEYLON (until 1948),1845-1850,"Sir J. Emerson Tennant, Bt.",
673,CEYLON (until 1948),1851-1860,Sir Charles J. MacCarthy,
674,CEYLON (until 1948),1860-1869,William C. Gibson,C.M.G.
675,CEYLON (until 1948),1869-1873,Sir H. Turner Irving,G.C.M.G.
676,CEYLON (until 1948),1873-1878,Sir Arthur N. Birch,K.C.M.G.
677,CEYLON (until 1948),1878-1885,Sir John Douglas,K.C.M.G.
678,CEYLON (until 1948),1885-1887,Rt. Hon. Sir Cecil Clementi-Smith,G.C.M.G.
679,CEYLON (until 1948),1887-1901,Sir Edward Noel Walker,K.C.M.G.
680,CEYLON (until 1948),1901-1904,Sir Everard im Thurn,"K.C.M.G., K.B.E., C.B."
681,CEYLON (until 1948),1904-1906,Sir Alexander M. Ashmore,K.C.M.G.
682,CEYLON (until 1948),1907-1912,Sir Hugh C. Clifford,"G.C.M.G., G.B.E."
683,CEYLON (until 1948),1913-1919,Sir R. Edward Stubbs,G.C.M.G.
684,CEYLON (until 1948),1919-1922,Sir Graeme Thomson,"G.C.M.G., K.C.B."
685,CEYLON (until 1948),1922-1925,Sir Cecil Clementi,G.C.M.G.
686,CEYLON (until 1948),1926-1929,"Sir A.G. Murchison Fletcher, K.C.M.G",C.B.E.
687,CEYLON (until 1948),1929-1932,Sir Bernard H. Bourdillon,"G.C.M.G., K.B.E."
688,CEYLON (until 1948),1932-1937,Sir F. Graeme Tyrrell,"K.B.E., C.M.G."
689,CEYLON (until 1948),1937-1940,Sir Maxwell M. Wedderburn,"K.B.E., C.M.G."
690,CEYLON (until 1948),1940-1942,Guy S. Woodman,C.M.G.
691,CEYLON (until 1948),1942-1947,Sir Robert H. Drayton,C.M.G.
692,Lieutenant-Governor/Chief Secretary,1847-1855,Henry Lushington,
693,Lieutenant-Governor/Chief Secretary,1855-1884,Sir E. Victor L. Houlton,G.C.M.G.
694,Lieutenant-Governor/Chief Secretary,1884-1889,Hon. Sir Walter F. Hely-Hutchinson,G.C.M.G.
695,Lieutenant-Governor/Chief Secretary,1889-1902,Lord Strickland,G.C.M.G.
696,Lieutenant-Governor/Chief Secretary,1902-1911,Sir Edward M. Merewether,"K.C.M.G., K.C.V.O."
697,Lieutenant-Governor/Chief Secretary,1911-1914,Major Sir John E. Clauson,"K.C.M.G., C.V.O."
698,Lieutenant-Governor/Chief Secretary,1914-1916,Sir Horace A. Byatt,G.C.M.G.
699,Lieutenant-Governor/Chief Secretary,1917-1925,Sir William C.F. Robertson,K.C.M.G.
700,Lieutenant-Governor/Chief Secretary,1925-1930,Sir Thomas A. Vans Best,"K.C.M.G., K.B.E."
701,Lieutenant-Governor/Chief Secretary,1930-1938,Sir Harry C. Luke,K.C.M.G.
702,Lieutenant-Governor/Chief Secretary,1938-1940,Sir John A. Hunter,K.C.M.G.
703,Lieutenant-Governor/Chief Secretary,1940-1943,"Sir Edward St.J. Jackson, K.C.M.G",K.B.E.
704,Lieutenant-Governor/Chief Secretary,1943-1952,Rt. Hon. Sir David C. Campbell,"K.B.E., C.M.G."
705,Lieutenant-Governor/Chief Secretary,1953-1959,Trafford Smith,C.M.G.
706,Lieutenant-Governor/Chief Secretary,1959-1962,Archibald Campbell,C.M.G.
707,CYPRUS (Governor from 1925 until 1960; High Commissioner until 1925),1878-1879,Field-Marshal Viscount Wolseley,"K.P., G.C.B., O.M., G.C.M.G."
708,CYPRUS (Governor from 1925 until 1960; High Commissioner until 1925),1879-1886,General Sir Robert Biddulph,"G.C.B., G.C.M.G."
709,CYPRUS (Governor from 1925 until 1960; High Commissioner until 1925),1886-1892,Sir Henry E.G. Bulwer,G.C.M.G.
710,CYPRUS (Governor from 1925 until 1960; High Commissioner until 1925),1892-1898,Sir Walter J. Sendall,G.C.M.G.
711,CYPRUS (Governor from 1925 until 1960; High Commissioner until 1925),1898-1904,Sir William F.H. Smith,K.C.M.G.
712,CYPRUS (Governor from 1925 until 1960; High Commissioner until 1925),1904-1911,Sir Charles A. King-Harman,K.C.M.G.
713,CYPRUS (Governor from 1925 until 1960; High Commissioner until 1925),1911-1915,Major Sir Hamilton J. Goold-Adams,"G.C.M.G., C.B."
714,CYPRUS (Governor from 1925 until 1960; High Commissioner until 1925),1915-1918,Major Sir John E. Clauson,"K.C.M.G., C.V.O."
715,CYPRUS (Governor from 1925 until 1960; High Commissioner until 1925),1920-1926,Sir Malcolm Stevenson,K.C.M.G.
716,CYPRUS (Governor from 1925 until 1960; High Commissioner until 1925),1926-1932,Sir Ronald H.A. Storrs,"K.C.M.G., C.B.E."
717,CYPRUS (Governor from 1925 until 1960; High Commissioner until 1925),1932-1933,Sir R. Edward Stubbs,G.C.M.G.
718,CYPRUS (Governor from 1925 until 1960; High Commissioner until 1925),1933-1939,Sir H. Richmond Palmer,"K.C.M.G., C.B.E."
719,CYPRUS (Governor from 1925 until 1960; High Commissioner until 1925),1939-1941,Sir William D. Battershill,K.C.M.G.
720,CYPRUS (Governor from 1925 until 1960; High Commissioner until 1925),1941-1946,Sir Charles C. Woolley,"G.B.E., K.C.M.G."
721,CYPRUS (Governor from 1925 until 1960; High Commissioner until 1925),1946-1949,Rt. Hon. Lord Winster,
722,CYPRUS (Governor from 1925 until 1960; High Commissioner until 1925),1949-1954,Sir Andrew B. Wright,"K.C.M.G., C.B.E., M.C."
723,CYPRUS (Governor from 1925 until 1960; High Commissioner until 1925),1954-1955,Sir Robert P. Armitage,"K.C.M.G., M.B.E."
724,CYPRUS (Governor from 1925 until 1960; High Commissioner until 1925),1955-1957,Field-Marshal Lord Harding of Petherton,"G.C.B., C.B.E., D.S.O."
725,CYPRUS (Governor from 1925 until 1960; High Commissioner until 1925),1957-1960,Rt. Hon. Lord Caradon,"G.C.M.G., K.C.V.O., O.B.E."
726,CYPRUS (Governor from 1925 until 1960; High Commissioner until 1925),1878-1879,Major-General Sir George R. Greaves,K.C.B.
727,CYPRUS (Governor from 1925 until 1960; High Commissioner until 1925),1879-1891,Colonel Falkland G.E. Warren,C.M.G.
728,CYPRUS (Governor from 1925 until 1960; High Commissioner until 1925),1891-1892,Sir George T.M. O’Brien,K.C.M.G.
729,CYPRUS (Governor from 1925 until 1960; High Commissioner until 1925),1892-1895,Harry L. Thompson,C.M.G.
730,CYPRUS (Governor from 1925 until 1960; High Commissioner until 1925),1895-1906,Captain Sir Arthur H. Young,"G.C.M.G., K.B.E."
731,CYPRUS (Governor from 1925 until 1960; High Commissioner until 1925),1906-1911,Major Sir John E. Clauson,"K.C.M.G., C.V.O."
732,CYPRUS (Governor from 1925 until 1960; High Commissioner until 1925),1911-1917,Major Sir Charles W.J. Orr,K.C.M.G.
733,CYPRUS (Governor from 1925 until 1960; High Commissioner until 1925),1917-1920,Sir Malcom Stevenson,K.C.M.G.
734,CYPRUS (Governor from 1925 until 1960; High Commissioner until 1925),1920-1926,John C.D. Fenn,C.M.G.
735,CYPRUS (Governor from 1925 until 1960; High Commissioner until 1925),1926-1929,Reginald P. Nicholson,C.M.G.
736,CYPRUS (Governor from 1925 until 1960; High Commissioner until 1925),1929-1934,Sir Herbert Henniker-Heaton,K.C.M.G.
737,CYPRUS (Governor from 1925 until 1960; High Commissioner until 1925),1934-1937,Sir William D. Battershill,K.C.M.G.
738,CYPRUS (Governor from 1925 until 1960; High Commissioner until 1925),1937-1940,Sir Andrew B. Wright,"K.C.M.G., C.B.E., M.C."
739,CYPRUS (Governor from 1925 until 1960; High Commissioner until 1925),1940-1943,Sir John V.W. Shaw,K.C.M.G.
740,CYPRUS (Governor from 1925 until 1960; High Commissioner until 1925),1943-1945,Rt. Hon. Lord Caradon,"G.C.M.G., K.C.V.O., O.B.E."
741,CYPRUS (Governor from 1925 until 1960; High Commissioner until 1925),1945-1950,Sir Roland E. Turnbull,K.C.M.G.
742,CYPRUS (Governor from 1925 until 1960; High Commissioner until 1925),1951-1955,Sir John Fletcher-Cooke,C.M.G.
743,CYPRUS (Governor from 1925 until 1960; High Commissioner until 1925),1955-1960,Sir George E. Sinclair,"C.M.G., O.B.E."
744,Colonial Secretary (Deputy Governor from 1955),1878-1879,Major-General Sir George R. Greaves,K.C.B.
745,Colonial Secretary (Deputy Governor from 1955),1879-1891,Colonel Falkland G.E. Warren,C.M.G.
746,Colonial Secretary (Deputy Governor from 1955),1891-1892,Sir George T.M. O’Brien,K.C.M.G.
747,Colonial Secretary (Deputy Governor from 1955),1892-1895,Harry L. Thompson,C.M.G.
748,Colonial Secretary (Deputy Governor from 1955),1895-1906,Captain Sir Arthur H. Young,"G.C.M.G., K.B.E."
749,Colonial Secretary (Deputy Governor from 1955),1906-1911,Major Sir John E. Clauson,"K.C.M.G., C.V.O."
750,Colonial Secretary (Deputy Governor from 1955),1911-1917,Major Sir Charles W.J. Orr,K.C.M.G.
751,Colonial Secretary (Deputy Governor from 1955),1917-1920,Sir Malcom Stevenson,K.C.M.G.
752,Colonial Secretary (Deputy Governor from 1955),1920-1926,John C.D. Fenn,C.M.G.
753,Colonial Secretary (Deputy Governor from 1955),1926-1929,Reginald P. Nicholson,C.M.G.
754,Colonial Secretary (Deputy Governor from 1955),1929-1934,Sir Herbert Henniker-Heaton,K.C.M.G.
755,Colonial Secretary (Deputy Governor from 1955),1934-1937,Sir William D. Battershill,K.C.M.G.
756,Colonial Secretary (Deputy Governor from 1955),1937-1940,Sir Andrew B. Wright,"K.C.M.G., C.B.E., M.C."
757,Colonial Secretary (Deputy Governor from 1955),1940-1943,Sir John V.W. Shaw,K.C.M.G.
758,Colonial Secretary (Deputy Governor from 1955),1943-1945,Rt. Hon. Lord Caradon,"G.C.M.G., K.C.V.O., O.B.E."
759,Colonial Secretary (Deputy Governor from 1955),1945-1950,Sir Roland E. Turnbull,K.C.M.G.
760,Colonial Secretary (Deputy Governor from 1955),1951-1955,Sir John Fletcher-Cooke,C.M.G.
761,Colonial Secretary (Deputy Governor from 1955),1955-1960,Sir George E. Sinclair,"C.M.G., O.B.E."
762,FALKLAND ISLANDS,1848-1855,George Rennie,
763,FALKLAND ISLANDS,1855-1862,Captain Thomas E.L. Moore,
764,FALKLAND ISLANDS,1862-1866,Captain James G. Mackenzie,
765,FALKLAND ISLANDS,1866-1870,Sir William C.F. Robinson,G.C.M.G.
766,FALKLAND ISLANDS,1870-1876,Colonel George A.K. D’Arcy,
767,FALKLAND ISLANDS,1876-1880,Jeremiah T. Fitzgerald Callaghan,C.M.G.
768,FALKLAND ISLANDS,1880-1886,Thomas Kerr,C.M.G.
769,FALKLAND ISLANDS,1886-1887,Arthur C.S. Barkly,
770,FALKLAND ISLANDS,1887-1891,Thomas Kerr,C.M.G.
771,FALKLAND ISLANDS,1891-1897,Sir Roger T. Goldsworthy,K.C.M.G.
772,FALKLAND ISLANDS,1897-1904,Sir William Grey-Wilson,K.C.M.G.
773,FALKLAND ISLANDS,1904-1914,Sir William L. Allardyce,G.C.M.G.
774,FALKLAND ISLANDS,1915-1919,Sir W. Douglas Young,"K.B.E., C.M.G."
775,FALKLAND ISLANDS,1920-1927,Sir John Middleton,"K.C.M.G., K.B.E."
776,FALKLAND ISLANDS,1927-1931,Sir Arnold W. Hodson,K.C.M.G.
777,FALKLAND ISLANDS,1931-1935,Sir James O’Grady,K.C.M.G.
778,FALKLAND ISLANDS,1935-1941,Sir Herbert Henniker-Heaton,K.C.M.G.
779,FALKLAND ISLANDS,1941-1946,Sir Allan W. Cardinall,"K.B.E., C.M.G."
780,FALKLAND ISLANDS,1946-1954,Sir G. Miles Clifford,"K.B.E., C.M.G."
781,FALKLAND ISLANDS,1954-1957,Sir O. Raynor Arthur,"K.C.M.G., C.V.O."
782,FALKLAND ISLANDS,1957-1964,Sir Edwin P. Arrowsmith,K.C.M.G.
783,FALKLAND ISLANDS,1964-1970,Sir Cosmo D.P.T. Haskard,"K.C.M.G., M.B.E."
784,FALKLAND ISLANDS,1971-1975,Ernest G. Lewis,"C.M.G., O.B.E."
785,FALKLAND ISLANDS,1975-1977,Neville A.I. French,"C.M.G., L.V.O."
786,FALKLAND ISLANDS,1977-1980,James R.W. Parker,"C.M.G., O.B.E."
787,FALKLAND ISLANDS,1980-1985,Sir Rex M. Hunt,C.M.G.
788,FALKLAND ISLANDS,1985-1988,Sir Gordon W. Jewkes,K.C.M.G.
789,FALKLAND ISLANDS,1988-1992,William H. Fullerton,C.M.G.
790,FALKLAND ISLANDS,1992-1996,David E. Tatham,C.M.G.
791,FALKLAND ISLANDS,1996-1999,Richard P. Ralph,"C.M.G., C.V.O."
792,FALKLAND ISLANDS,1999-2002,Donald A. Lamont,
793,FALKLAND ISLANDS,2002-2006,Howard J.S. Pearce,C.V.O.
794,FALKLAND ISLANDS,2006-2010,Alan E. Huckle,
795,FALKLAND ISLANDS,2010-2014,Nigel R. Haywood,C.V.O.
796,FALKLAND ISLANDS,2014-2017,Colin Roberts,C.V.O.
797,FALKLAND ISLANDS,2017-,Air Commodore Nigel J. Phillips,C.B.E.
798,FIJI (from 1874 until 1970),1874-1875,Rt. Hon. Lord Rosmead,G.C.M.G.
799,FIJI (from 1874 until 1970),1875-1880,Lord Stanmore,G.C.M.G.
800,FIJI (from 1874 until 1970),1880-1886,Sir G. William Des Voeux,G.C.M.G.
801,FIJI (from 1874 until 1970),1887-1888,Sir Charles B.H. Mitchell,G.C.M.G.
802,FIJI (from 1874 until 1970),1888-1897,Sir John B. Thurston,K.C.M.G.
803,FIJI (from 1874 until 1970),1897-1901,Sir George T.M. O’Brien,K.C.M.G.
804,FIJI (from 1874 until 1970),1902-1904,Sir Henry M. Jackson,G.C.M.G.
805,FIJI (from 1874 until 1970),1904-1910,Sir Everard F. im Thurn,"K.C.M.G., K.B.E., C.B."
806,FIJI (from 1874 until 1970),1910-1912,Sir Francis H. May,G.C.M.G.
807,FIJI (from 1874 until 1970),1912-1918,Sir Ernest B. Sweet-Escott,K.C.M.G.
808,FIJI (from 1874 until 1970),1918-1925,Sir Cecil Hunter-Rodwell,G.C.M.G.
809,FIJI (from 1874 until 1970),1925-1929,Sir Eyre Hutson,K.C.M.G.
810,FIJI (from 1874 until 1970),1929-1936,Sir A.G. Murchison Fletcher,"K.C.M.G., C.B.E."
811,FIJI (from 1874 until 1970),1936-1938,Lord Milverton,G.C.M.G.
812,FIJI (from 1874 until 1970),1938-1942,Sir Harry C. Luke,K.C.M.G.
813,FIJI (from 1874 until 1970),1942-1945,Major-General Sir Philip E. Mitchell,"G.C.M.G., M.C."
814,FIJI (from 1874 until 1970),1945-1948,Sir Alexander W.G.H. Grantham,G.C.M.G.
815,FIJI (from 1874 until 1970),1948-1952,Sir L. Brian Freeston,"K.C.M.G., O.B.E."
816,FIJI (from 1874 until 1970),1952-1958,Sir Ronald H. Garvey,"K.C.M.G., K.C.V.O., M.B.E."
817,FIJI (from 1874 until 1970),1958-1963,Sir Kenneth P. Maddocks,"K.C.M.G., K.C.V.O."
818,FIJI (from 1874 until 1970),1963-1968,Sir F. Derek Jakeway,"K.C.M.G., O.B.E."
819,FIJI (from 1874 until 1970),1968-1970,Sir Robert S. Foster,"G.C.M.G., K.C.V.O."
820,FIJI (from 1874 until 1970),1874-1897,Sir John B. Thurston,K.C.M.G.
821,FIJI (from 1874 until 1970),1897-1901,Sir George T.M. O’Brien,K.C.M.G.
822,FIJI (from 1874 until 1970),1902-1904,Sir William L. Allardyce,G.C.M.G.
823,FIJI (from 1874 until 1970),1904-1908,Arthur W. Mahaffy,
824,FIJI (from 1874 until 1970),1908-1918,Sir Eyre Hutson,K.C.M.G.
825,FIJI (from 1874 until 1970),1919-1926,Thomas E. Fell,C.M.G.
826,FIJI (from 1874 until 1970),1926-1935,Alfred M. Seymour,C.M.G.
827,FIJI (from 1874 until 1970),1936-1941,Cecil Juxon T.T. Barton,"C.M.G., O.B.E."
828,FIJI (from 1874 until 1970),1942-1944,Sir Alexander T. Newboult,"K.B.E., C.M.G., M.C."
829,FIJI (from 1874 until 1970),1945-1949,Sir John F. Nicoll,K.C.M.G.
830,FIJI (from 1874 until 1970),1949-1957,Alexander F.R. Stoddart,C.M.G.
831,FIJI (from 1874 until 1970),1957-1966,Patrick D. Macdonald,"C.M.G., C.V.O."
832,FIJI (from 1874 until 1970),1966-1970,G. Peter Lloyd,"C.M.G., C.V.O."
833,Colonial Secretary (Chief Secretary from 196_),1874-1897,Sir John B. Thurston,K.C.M.G.
834,Colonial Secretary (Chief Secretary from 196_),1897-1901,Sir George T.M. O’Brien,K.C.M.G.
835,Colonial Secretary (Chief Secretary from 196_),1902-1904,Sir William L. Allardyce,G.C.M.G.
836,Colonial Secretary (Chief Secretary from 196_),1904-1908,Arthur W. Mahaffy,
837,Colonial Secretary (Chief Secretary from 196_),1908-1918,Sir Eyre Hutson,K.C.M.G.
838,Colonial Secretary (Chief Secretary from 196_),1919-1926,Thomas E. Fell,C.M.G.
839,Colonial Secretary (Chief Secretary from 196_),1926-1935,Alfred M. Seymour,C.M.G.
840,Colonial Secretary (Chief Secretary from 196_),1936-1941,Cecil Juxon T.T. Barton,"C.M.G., O.B.E."
841,Colonial Secretary (Chief Secretary from 196_),1942-1944,Sir Alexander T. Newboult,"K.B.E., C.M.G., M.C."
842,Colonial Secretary (Chief Secretary from 196_),1945-1949,Sir John F. Nicoll,K.C.M.G.
843,Colonial Secretary (Chief Secretary from 196_),1949-1957,Alexander F.R. Stoddart,C.M.G.
844,Colonial Secretary (Chief Secretary from 196_),1957-1966,Patrick D. Macdonald,"C.M.G., C.V.O."
845,Colonial Secretary (Chief Secretary from 196_),1966-1970,G. Peter Lloyd,"C.M.G., C.V.O."
846,GAMBIA (from 1901 until 1965),1901-1911,Sir George C. Denton,K.C.M.G.
847,GAMBIA (from 1901 until 1965),1911-1914,Lieutenant-Colonel Sir Henry L. Galway,"K.C.M.G., D.S.O."
848,GAMBIA (from 1901 until 1965),1914-1920,Sir Edward J. Cameron,K.C.M.G.
849,GAMBIA (from 1901 until 1965),1920-1927,Captain Sir Cecil H. Armitage,"K.B.E., C.M.G., D.S.O."
850,GAMBIA (from 1901 until 1965),1927-1928,Sir John Middleton,"K.C.M.G., K.B.E."
851,GAMBIA (from 1901 until 1965),1928-1930,Sir Edward B. Denham,"G.C.M.G., K.B.E."
852,GAMBIA (from 1901 until 1965),1930-1933,Sir H. Richmond Palmer,"K.C.M.G., C.B.E."
853,GAMBIA (from 1901 until 1965),1933-1936,Lord Milverton,G.C.M.G.
854,GAMBIA (from 1901 until 1965),1936-1942,Sir W. Thomas Southorn,"K.C.M.G., K.B.E."
855,GAMBIA (from 1901 until 1965),1942-1947,Sir Hilary R.R. Blood,"G.B.E., K.C.M.G."
856,GAMBIA (from 1901 until 1965),1947-1949,Sir Andrew B. Wright,"K.C.M.G., C.B.E., M.C."
857,GAMBIA (from 1901 until 1965),1949-1958,Sir Percy Wyn-Harris,"K.C.M.G., M.B.E."
858,GAMBIA (from 1901 until 1965),1958-1962,Sir Edward H. Windley,"K.C.M.G., K.C.V.O."
859,GAMBIA (from 1901 until 1965),1962-1965,Sir John W. Paul,"G.C.M.G., O.B.E., M.C."
860,GAMBIA (from 1901 until 1965),1902-1909,Horace M. Brandforth Griffith,C.M.G.
861,GAMBIA (from 1901 until 1965),1910-1912,Lieutenant-Colonel Sir Charles R.M. O’Brien,K.C.M.G.
862,GAMBIA (from 1901 until 1965),1912-1917,William Telfer Campbell,
863,GAMBIA (from 1901 until 1965),1917-1921,Sir Herbert Henniker Heaton,K.C.M.G.
864,GAMBIA (from 1901 until 1965),1921-1931,Charles R.M. Workman,C.B.E.
865,GAMBIA (from 1901 until 1965),1932-1934,Godfrey C.B. Parish,
866,GAMBIA (from 1901 until 1965),1934-1940,Captain Harris R. Oke,"C.M.G., O.B.E., M.C."
867,GAMBIA (from 1901 until 1965),1941-1943,Sir Kenneth W. Blackburne,"G.C.M.G., G.B.E."
868,GAMBIA (from 1901 until 1965),1943-1947,George D. Chamberlain,C.M.G.
869,GAMBIA (from 1901 until 1965),1947-1952,Edward R. Ward,C.M.G.
870,GAMBIA (from 1901 until 1965),1952-1956,Sir Alexander N.A. Waddell,"K.C.M.G., D.S.C."
871,GAMBIA (from 1901 until 1965),1956-1962,Kenneth G.S. Smith,C.M.G.
872,Colonial Secretary (Civil Secretary from 1958),1902-1909,Horace M. Brandforth Griffith,C.M.G.
873,Colonial Secretary (Civil Secretary from 1958),1910-1912,Lieutenant-Colonel Sir Charles R.M. O’Brien,K.C.M.G.
874,Colonial Secretary (Civil Secretary from 1958),1912-1917,William Telfer Campbell,
875,Colonial Secretary (Civil Secretary from 1958),1917-1921,Sir Herbert Henniker Heaton,K.C.M.G.
876,Colonial Secretary (Civil Secretary from 1958),1921-1931,Charles R.M. Workman,C.B.E.
877,Colonial Secretary (Civil Secretary from 1958),1932-1934,Godfrey C.B. Parish,
878,Colonial Secretary (Civil Secretary from 1958),1934-1940,Captain Harris R. Oke,"C.M.G., O.B.E., M.C."
879,Colonial Secretary (Civil Secretary from 1958),1941-1943,Sir Kenneth W. Blackburne,"G.C.M.G., G.B.E."
880,Colonial Secretary (Civil Secretary from 1958),1943-1947,George D. Chamberlain,C.M.G.
881,Colonial Secretary (Civil Secretary from 1958),1947-1952,Edward R. Ward,C.M.G.
882,Colonial Secretary (Civil Secretary from 1958),1952-1956,Sir Alexander N.A. Waddell,"K.C.M.G., D.S.C."
883,Colonial Secretary (Civil Secretary from 1958),1956-1962,Kenneth G.S. Smith,C.M.G.
884,GIBRALTAR,1848-1855,General Sir Robert Gardiner,G.C.B.
885,GIBRALTAR,1855-1859,General Sir Janies Fergusson,G.C.B.
886,GIBRALTAR,1859-1865,General Sir William J. Codrington,G.C.B.
887,GIBRALTAR,1865-1879,General Lord Airey,G.C.B.
888,GIBRALTAR,1870-1876,"General Sir William F. Williams, Bt.",G.C.B.
889,GIBRALTAR,1876-1883,Field-Marshal Lord Napier of Magdala,"G.C.B., G.C.S.I."
890,GIBRALTAR,1883-1886,General Sir John M. Adye,G.C.B.
891,GIBRALTAR,1886-1890,General the Hon. Sir Arthur E. Hardinge,"K.C.B., C.I.E."
892,GIBRALTAR,1890-1891,General the Hon. Sir Leicester Smyth,"K.C.B., K.C.M.G."
893,GIBRALTAR,1891-1893,General Sir Lothian Nicholson,K.C.B.
894,GIBRALTAR,1893-1900,General Sir Robert Biddulph,"G.C.B., G.C.M.G."
895,GIBRALTAR,1900-1905,"Field-Marshal Sir George S. White, V.C.","G.C.B., O.M., G.C.S.I., G.C.M.G., G.C.I.E., G.C.V.O."
896,GIBRALTAR,1905-1910,General Sir Frederick W.E.F. Forestier-Walker,G.C.M.G.
897,GIBRALTAR,1910-1913,General Sir Archibald Hunter,"G.C.B., G.C.V.O., D.S.O."
898,GIBRALTAR,1913-1918,Lieutenant-General Sir Herbert S.G. Miles,"G.C.B., G.C.M.G., G.B.E., C.V.O."
899,GIBRALTAR,1918-1923,General Sir Horace L. Smith-Dorrien,"G.C.B., G.C.M.G."
900,GIBRALTAR,1923-1928,"General Sir Charles C. Monro, Bt.","G.C.B., G.C.S.I."
901,GIBRALTAR,1928-1933,General Sir Alexander J. Godley,"G.C.B., K.C.M.G."
902,GIBRALTAR,1933-1938,General Sir Charles H. Harington,"G.C.B., G.B.E., D.S.O."
903,GIBRALTAR,1938-1939,Field-Marshal Lord Ironside,"G.C.B., C.M.G., D.S.O."
904,GIBRALTAR,1939-1941,General Sir Clive G. Liddell,"K.C.B., C.M.G., C.B.E., D.S.O."
905,GIBRALTAR,1941-1942,"Field-Marshal Viscount Gort, V.C.","G.C.B., C.B.E., D.S.O., M.V.O., M.C."
906,GIBRALTAR,1942-1944,Lieutenant-General Sir Frank N. Mason-MacFarlane,"K.C.B., D.S.O., M.C."
907,GIBRALTAR,1944-1947,Lieutenant-General Sir T. Ralph Eastwood,"K.C.B., D.S.O."
908,GIBRALTAR,1947-1952,General Sir Kenneth A. N. Anderson,"K.C.B., M.C."
909,GIBRALTAR,1952-1958,General Sir Gordon H.A. MacMillan,"K.C.B., K.C.V.O., C.B.E., D.S.O., M.C."
910,GIBRALTAR,1955-1958,Lieutenant-General Sir Harold Redman,"K.C.B., C.B.E."
911,GIBRALTAR,1958-1962,General Sir Charles F. Keightley,"G.C.B., G.B.E., D.S.O."
912,GIBRALTAR,1962-1965,General Sir A. Dudley Ward,"G.C.B., K.B.E., D.S.O."
913,GIBRALTAR,1965-1969,General Sir Gerald W. Lathbury,"G.C.B., D.S.O., M.B.E."
914,GIBRALTAR,1969-1973,Admiral of the Fleet Sir Varyl C. Begg,"G.C.B., D.S.O."
915,GIBRALTAR,1973-1978,Marshal of the Royal Air Force Sir John Grandy,"G.C.B., G.C.V.O., K.B.E., D.S.O."
916,GIBRALTAR,1978-1982,General Sir William G.F. Jackson,"G.B.E., K.C.B., M.C."
917,GIBRALTAR,1982-1985,Admiral Sir David Williams,G.C.B.
918,GIBRALTAR,1985-1989,Air Chief Marshal Sir Peter D.G. Terry,G.C.B.
919,GIBRALTAR,1989-1993,Admiral Sir Derek R. Reffell,K.C.B.
920,GIBRALTAR,1993-1995,Field-Marshal Sir John L. Chappie,"G.C.B., C.B.E."
921,GIBRALTAR,1995-1997,Admiral Sir Hugo M. White,"G.C.B., C.B.E."
922,GIBRALTAR,1997-2000,Rt. Hon. Lord Luce,"K.G., G.C.V.O."
923,GIBRALTAR,2000-2003,Sir David R.C. Durie,K.C.M.G.
924,GIBRALTAR,2003-2006,Sir Francis N. Richards,"K.C.M.G., C.V.O."
925,GIBRALTAR,2006-2009,Lieutenant-General Sir Robert H.G. Fulton,K.B.E.
926,GIBRALTAR,2009-2013,Vice-Admiral Sir Adrian J. Johns,"K.C.B., C.B.E."
927,GIBRALTAR,2013-2015,Lieutenant-General Sir James B. Dutton,"K.C.B., C.B.E."
928,GIBRALTAR,2016-,Lieutenant-General Edward G.M. Davis,"C.B., C.B.E."
929,GIBRALTAR,18_-1859,George Adderley,
930,GIBRALTAR,1859-1868,Sir Sanford Freeling,K.C.M.G.
931,GIBRALTAR,1868-1882,Lieutenant-General Robert S. Baynes,
932,GIBRALTAR,1883-1888,"Lord Gifford, V.C.",
933,GIBRALTAR,1888-1894,Sir C. Cavendish Boyle,K.C.M.G.
934,GIBRALTAR,1894-1901,Sir Henry M. Jackson,G.C.M.G.
935,GIBRALTAR,1901-1914,Sir Frederick Evans,"K.C.M.G., K.C.V.O., C.B.E."
936,GIBRALTAR,1915-1917,Sir William C.F. Robertson,K.C.M.G.
937,GIBRALTAR,1917-1919,Sir Frederick Evans,"K.C.M.G., K.C.V.O., C.B.E."
938,GIBRALTAR,1919-1926,Major Sir Charles W.J. Orr,K.C.M.G.
939,GIBRALTAR,1927-1929,Major Sir Hubert W. Young,"K.C.M.G., D.S.O."
940,GIBRALTAR,1930-1941,Lieutenant-Colonel Alexander E. Beattie,"C.M.G., C.B.E., M.C."
941,GIBRALTAR,1942,Rt. Hon. Sir David C. Campbell,"K.B.E., C.M.G."
