,Position,date,persName,roleName
1,"ADEN (from 1937 until 1963; HIGH COMMISSIONER, FEDERATION OF SOUTH ARABIA from 1963 until 1968)",1937-1940,Lieutenant-Colonel Sir Bernard R. Reilly,"K.C.M.G., C.I.E., O.B.E."
2,"ADEN (from 1937 until 1963; HIGH COMMISSIONER, FEDERATION OF SOUTH ARABIA from 1963 until 1968)",1940-1944,Sir John H. Hall,"G.C.M.G., D.S.O., O.B.E., M.C."
3,"ADEN (from 1937 until 1963; HIGH COMMISSIONER, FEDERATION OF SOUTH ARABIA from 1963 until 1968)",1944-1951,Sir Reginald S. Champion,"K.C.M.G., O.B.E."
4,"ADEN (from 1937 until 1963; HIGH COMMISSIONER, FEDERATION OF SOUTH ARABIA from 1963 until 1968)",1951-1956,Sir Tom Hickinbotham,"K.C.M.G., K.C.V.O., C.I.E., O.B.E."
5,"ADEN (from 1937 until 1963; HIGH COMMISSIONER, FEDERATION OF SOUTH ARABIA from 1963 until 1968)",1956-1960,Sir William H.T. Luce,"G.B.E., K.C.M.G."
6,"ADEN (from 1937 until 1963; HIGH COMMISSIONER, FEDERATION OF SOUTH ARABIA from 1963 until 1968)",1960-1963,Sir Charles H. Johnston,G.C.M.G.
7,"ADEN (from 1937 until 1963; HIGH COMMISSIONER, FEDERATION OF SOUTH ARABIA from 1963 until 1968)",1963-1965,Sir G. Kennedy N. Trevaskis,"K.C.M.G., O.B.E."
8,"ADEN (from 1937 until 1963; HIGH COMMISSIONER, FEDERATION OF SOUTH ARABIA from 1963 until 1968)",1965-1967,Sir Richard G. Turnbull,G.C.M.G.
9,"ADEN (from 1937 until 1963; HIGH COMMISSIONER, FEDERATION OF SOUTH ARABIA from 1963 until 1968)",1967,Lord Trevelyan,"K.G., G.C.M.G., C.I.E., O.B.E."
10,"ADEN (from 1937 until 1963; HIGH COMMISSIONER, FEDERATION OF SOUTH ARABIA from 1963 until 1968)",1937-1940,Lieutenant-Colonel Morice C. Lake,C.M.G.
11,"ADEN (from 1937 until 1963; HIGH COMMISSIONER, FEDERATION OF SOUTH ARABIA from 1963 until 1968)",1940-1942,W. Harold Ingrams,"C.M.G., O.B.E."
12,"ADEN (from 1937 until 1963; HIGH COMMISSIONER, FEDERATION OF SOUTH ARABIA from 1963 until 1968)",1942-1944,Sir Reginald S. Champion,"K.C.M.G., O.B.E."
13,"ADEN (from 1937 until 1963; HIGH COMMISSIONER, FEDERATION OF SOUTH ARABIA from 1963 until 1968)",1944-1947,Alan L. Kirkbride,O.B.E.
14,"ADEN (from 1937 until 1963; HIGH COMMISSIONER, FEDERATION OF SOUTH ARABIA from 1963 until 1968)",1947-1949,Ambler R. Thomas,C.M.G.
15,"ADEN (from 1937 until 1963; HIGH COMMISSIONER, FEDERATION OF SOUTH ARABIA from 1963 until 1968)",1949-1953,Sir William A.C. Goode,G.C.M.G.
16,"ADEN (from 1937 until 1963; HIGH COMMISSIONER, FEDERATION OF SOUTH ARABIA from 1963 until 1968)",1953-1957,Sir Evelyn D. Hone,"G.C.M.G., C.V.O., O.B.E."
17,"ADEN (from 1937 until 1963; HIGH COMMISSIONER, FEDERATION OF SOUTH ARABIA from 1963 until 1968)",1957-1963,Kenneth W. Simmonds,C.M.G.
18,"ADEN (from 1937 until 1963; HIGH COMMISSIONER, FEDERATION OF SOUTH ARABIA from 1963 until 1968)",1963-1967,Sir Thomas Oates,"C.M.G., O.B.E."
19,"ADEN (from 1937 until 1963; HIGH COMMISSIONER, FEDERATION OF SOUTH ARABIA from 1963 until 1968)",1966-1967,Sir A. John Wilton,"K.C.M.G., K.C.V.O., M.C."
20,Chief Secretary (Deputy High Commissioner from 1963),1937-1940,Lieutenant-Colonel Morice C. Lake,C.M.G.
21,Chief Secretary (Deputy High Commissioner from 1963),1940-1942,W. Harold Ingrams,"C.M.G., O.B.E."
22,Chief Secretary (Deputy High Commissioner from 1963),1942-1944,Sir Reginald S. Champion,"K.C.M.G., O.B.E."
23,Chief Secretary (Deputy High Commissioner from 1963),1944-1947,Alan L. Kirkbride,O.B.E.
24,Chief Secretary (Deputy High Commissioner from 1963),1947-1949,Ambler R. Thomas,C.M.G.
25,Chief Secretary (Deputy High Commissioner from 1963),1949-1953,Sir William A.C. Goode,G.C.M.G.
26,Chief Secretary (Deputy High Commissioner from 1963),1953-1957,Sir Evelyn D. Hone,"G.C.M.G., C.V.O., O.B.E."
27,Chief Secretary (Deputy High Commissioner from 1963),1957-1963,Kenneth W. Simmonds,C.M.G.
28,Chief Secretary (Deputy High Commissioner from 1963),1963-1967,Sir Thomas Oates,"C.M.G., O.B.E."
29,Chief Secretary (Deputy High Commissioner from 1963),1966-1967,Sir A. John Wilton,"K.C.M.G., K.C.V.O., M.C."
30,ANGUILLA (from 1982),1982-1983,Charles H. Godden,C.B.E.
31,ANGUILLA (from 1982),1983-1987,Alastair T. Baillie,
32,ANGUILLA (from 1982),1987-1989,Geoffrey O. Whittaker,O.B.E.
33,ANGUILLA (from 1982),1989-1992,Brian J.G. Canty,C.B.E.
34,ANGUILLA (from 1982),1992-1995,Alan W. Shave,"C.V.O., O.B.E."
35,ANGUILLA (from 1982),1995-1996,Alan Hoole,"C.M.G., O.B.E."
36,ANGUILLA (from 1982),1997-2000,Robert M. Harris,
37,ANGUILLA (from 1982),2000-2004,Peter Johnstone,C.M.G.
38,ANGUILLA (from 1982),2004-2006,Alan E. Huckle,
39,ANGUILLA (from 1982),2006-2009,Andrew N. George,
40,ANGUILLA (from 1982),2009-2013,W. Alistair Harrison,"C.M.G., C.V.O."
41,ANGUILLA (from 1982),2013-2017,Christina M.E. Scott,
42,ANGUILLA (from 1982),2017-,Timothy Foy,O.B.E.
43,Governor-General (from 1850 until 1861 and from 1901),1850-1855,Sir Charles A. Fitzroy,K.C.B.
44,Governor-General (from 1850 until 1861 and from 1901),1855-1861,Sir William T. Denison,K.C.B.
45,Governor-General (from 1850 until 1861 and from 1901),1901-1903,Rt. Hon. Marquess of Linlithgow,"K.T., G.C.M.G., G.C.V.O."
46,Governor-General (from 1850 until 1861 and from 1901),1903-1904,Rt. Hon. Lord Tennyson,G.C.M.G.
47,Governor-General (from 1850 until 1861 and from 1901),1904-1908,Rt. Hon. Lord Northcote,"G.C.M.G., G.C.I.E., C.B."
48,Governor-General (from 1850 until 1861 and from 1901),1908-1911,Rt. Hon. Earl of Dudley,"G.C.B., G.C.M.G., G.C.V.O."
49,Governor-General (from 1850 until 1861 and from 1901),1911-1914,Rt. Hon. Lord Denman,"G.C.M.G., K.C.V.O."
50,Governor-General (from 1850 until 1861 and from 1901),1914-1920,Rt. Hon. Viscount Novar,"K.T., G.C.M.G."
51,Governor-General (from 1850 until 1861 and from 1901),1920-1925,Rt. Hon. Lord Forster,G.C.M.G.
52,Governor-General (from 1850 until 1861 and from 1901),1925-1931,Rt. Hon. Viscount Stonehaven,"G.C.M.G., D.S.O."
53,Governor-General (from 1850 until 1861 and from 1901),1931-1936,Sir Isaac A. Isaacs,"G.C.B., G.C.M.G."
54,Governor-General (from 1850 until 1861 and from 1901),1936-1945,"Brigadier-General Rt. Hon. Earl of Gowrie, V.C.","G.C.M.G., C.B., D.S.O."
55,Governor-General (from 1850 until 1861 and from 1901),1945-1947,H.R.H. Duke of Gloucester,"K.G., K.T., K.P., G.C.B., G.C.M.G., G.C.V.O."
56,Governor-General (from 1850 until 1861 and from 1901),1947-1953,Rt. Hon. Sir William J. McKell,G.C.M.G.
57,Governor-General (from 1850 until 1861 and from 1901),1953-1960,Field-Marshal Viscount Slim,"K.G., G.C.B., G.C.M.G., G.C.V.O., G.B.E., D.S.O., M.C."
58,Governor-General (from 1850 until 1861 and from 1901),1960-1961,Rt. Hon. Viscount Dunrossil,"G.C.M.G., M.C."
59,Governor-General (from 1850 until 1861 and from 1901),1961-1965,"Rt. Hon. Viscount De L’Isle, V.C.","K.G., G.C.M.G., G.C.V.O."
60,Governor-General (from 1850 until 1861 and from 1901),1965-1969,Rt. Hon. Lord Casey,"K.G., G.C.M.G., C.H., D.S.O., M.C."
61,Governor-General (from 1850 until 1861 and from 1901),1969-1974,Rt. Hon. Sir Paul M.C. Hasluck,"K.G., G.C.M.G., G.C.V.O."
62,Governor-General (from 1850 until 1861 and from 1901),1974-1977,Rt. Hon. Sir John R. Kerr,"G.C.M.G., G.C.V.O."
63,Governor-General (from 1850 until 1861 and from 1901),1977-1982,Rt. Hon. Sir Zelman Cowen,"G.C.M.G., G.C.V.O."
64,Governor-General (from 1850 until 1861 and from 1901),1982-1989,Rt. Hon. Sir Ninian M. Stephen,"K.G., G.C.M.G., G.C.V.O."
65,Governor-General (from 1850 until 1861 and from 1901),1989-1996,William G. Hayden,
66,Governor-General (from 1850 until 1861 and from 1901),1996-2001,Sir William P. Deane,K.B.E.
67,Governor-General (from 1850 until 1861 and from 1901),2001-2003,Rt. Rev. Peter J. Hollingworth,
68,Governor-General (from 1850 until 1861 and from 1901),2003-2008,Major-General P. Michael Jeffrey,"C.V.O., M.C."
69,Governor-General (from 1850 until 1861 and from 1901),2008-2014,Quentin A.L. Bryce,C.V.O.
70,Governor-General (from 1850 until 1861 and from 1901),2014-,General Peter J. Cosgrove,
71,NEW SOUTH WALES,1846-1855,Sir Charles A. Fitzroy,K.C.B.
72,NEW SOUTH WALES,1855-1861,Sir William T. Denison,K.C.B.
73,NEW SOUTH WALES,1861-1867,Rt. Hon. Lord Lisgar,"G.C.B., G.C.M.G."
74,NEW SOUTH WALES,1868-1872,Rt. Hon. the Earl Belmore,G.C.M.G.
75,NEW SOUTH WALES,1872-1879,Rt. Hon. Lord Rosmead,G.C.M.G.
76,NEW SOUTH WALES,1879-1885,Rt. Hon. Lord Augustus W.F.S. Loftus,G.C.B.
77,NEW SOUTH WALES,1885-1890,Rt. Hon The Marquess of Lincolnshire,"K.G., G.C.M.G."
78,NEW SOUTH WALES,1890-1893,Rt. Hon the Earl of Jersey,"G.C.B., G.C.M.G."
79,NEW SOUTH WALES,1893-1895,Rt. Hon. Sir Robert W. Duff,G.C.M.G.
80,NEW SOUTH WALES,1895-1899,Viscount Hampden,G.C.M.G.
81,NEW SOUTH WALES,1899-1901,Rt. Hon. Earl Beauchamp,"K.G., K.C.M.G."
82,NEW SOUTH WALES,1902-1909,Admiral Sir Harry H. Rawson,"G.C.B., G.C.M.G."
83,NEW SOUTH WALES,1909-1913,Rt. Hon. Viscount Chelmsford,"G.C.S.I., G.C.M.G., G.C.I.E., G.B.E."
84,NEW SOUTH WALES,1913-1917,Rt. Hon. Lord Strickland,G.C.M.G.
85,NEW SOUTH WALES,1918-1923,Sir Walter E. Davidson,K.C.M.G.
86,NEW SOUTH WALES,1924-1930,Admiral Sir Dudley R.S. de Chair,"K.C.B., K.C.M.G., K.B.E., M.V.O."
87,NEW SOUTH WALES,1930-1935,Air Vice-Marshal Sir Philip W. Game,"G.C.B., G.C.V.O., G.B.E., K.C.M.G., D.S.O."
88,NEW SOUTH WALES,1935-1936,Brigadier-General Rt. Hon. the Earl of Gowrie,C.B.
89,NEW SOUTH WALES,1936,Admiral Sir D. Murray Anderson,"K.C.B., K.C.M.G., M.V.O."
90,NEW SOUTH WALES,1937-1946,Lord Wakehurst,"K.G., K.C.M.G."
91,NEW SOUTH WALES,1946-1957,Lieutenant-General Sir John Northcott,"K.C.M.G., K.C.V.O., C.B.E."
92,NEW SOUTH WALES,1957-1965,Lieutenant-General Sir Eric W. Woodward,"K.C.M.G., K.C.V.O., C.B., C.B.E., D.S.O."
93,NEW SOUTH WALES,1966-1981,Sir A. Roden Cutler,"V.C., K.C.M.G., K.C.V.O., C.B.E."
94,NEW SOUTH WALES,1981-1989,Air Marshal Sir James A. Rowland,"K.B.E., D.F.C., A.F.C."
95,NEW SOUTH WALES,1989-1990,Rear-Admiral Sir David J. Martin,K.C.M.G.
96,NEW SOUTH WALES,1990-1996,Rear-Admiral Peter R. Sinclair,
97,NEW SOUTH WALES,1996-2001,Gordon J. Samuels,C.V.O.
98,NEW SOUTH WALES,2001-,Marie R. Bashir,C.V.O.
99,QUEENSLAND (from 1859),1859-1868,Rt. Hon. Sir George F. Bowen,G.C.M.G.
100,QUEENSLAND (from 1859),1868-1871,Colonel Samuel W. Blackall,
101,QUEENSLAND (from 1859),1871-1874,Rt. Hon. the Marquess of Normanby,"G.C.B., G.C.M.G."
102,QUEENSLAND (from 1859),1875-1877,Sir William W. Cairns,K.C.M.G.
103,QUEENSLAND (from 1859),1877-1883,Sir Arthur E. Kennedy,G.C.M.G.
104,QUEENSLAND (from 1859),1883-1888,Sir Anthony Musgrave,K.C.M.G.
105,QUEENSLAND (from 1859),1889-1895,Field-Marshal Sir Henry W. Norman,"G.C.B., G.C.M.G."
106,QUEENSLAND (from 1859),1896-1901,Lord Lamington,"G.C.M.G., G.C.I.E."
107,QUEENSLAND (from 1859),1902-1904,Lieutenant-General Sir Herbert C. Chermside,G.C.M.G.
108,QUEENSLAND (from 1859),1905-1909,Rt. Hon. Viscount Chelmsford,"G.C.M.G., G.C.S.I., G.C.I.E., G.B.E."
109,QUEENSLAND (from 1859),1909-1914,Rt. Hon. Sir William MacGregor,"G.C.M.G., C.B."
110,QUEENSLAND (from 1859),1915-1920,Major Sir Hamilton J. Goold-Adams,"G.C.M.G., C.B."
111,QUEENSLAND (from 1859),1920-1925,"Lieutenant-Colonel the Rt. Hon. Sir Matthew Nathan, G.",
112,QUEENSLAND (from 1859),1927-1932,Lieutenant-General Sir T.H. John C. Goodwin,"K.C.B., K.C.M.G., D.S.O."
113,QUEENSLAND (from 1859),1932-1946,Lieutenant-Colonel the Rt. Hon. Sir Leslie O. Wilson,"G.C.M.G., G.C.S.I., G.C.I.E., D.S.O."
114,QUEENSLAND (from 1859),1946-1957,Lieutenant-General Sir John D. Lavarack,"K.C.M.G., K.C.V.O., K.B.E., C.B., D.S.O."
115,QUEENSLAND (from 1859),1958-1966,Colonel Sir Henry Abel Smith,"K.C.M.G., K.C.V.O."
116,QUEENSLAND (from 1859),1966-1972,Sir Alan J. Mansfield,"K.C.M.G., K.C.V.O."
117,QUEENSLAND (from 1859),1972-1977,Air Marshal Sir Colin T. Hannah,"K.C.M.G., K.C.V.O., K.B.E., C.B."
118,QUEENSLAND (from 1859),1977-1985,Commodore Sir James M. Ramsay,"K.C.M.G., K.C.V.O., C.B.E., D.S.C."
119,QUEENSLAND (from 1859),1985-1992,Sir Walter B. Campbell,
120,QUEENSLAND (from 1859),1992-1997,M.M. Leneen Forde,
121,QUEENSLAND (from 1859),1997-2003,Major-General Peter M. Armison,C.V.O.
122,QUEENSLAND (from 1859),2003-2008,Quentin A.L. Bryce,
123,QUEENSLAND (from 1859),2008-,Penelope A. Wensley,
124,SOUTH AUSTRALIA,1848-1854,Sir Henry E.F. Young,K.C.M.G.
125,SOUTH AUSTRALIA,1855-1862,Sir Richard G. MacDonnell,"K.C.M.G., C.B."
126,SOUTH AUSTRALIA,1862-1868,Sir Dominick Daly,
127,SOUTH AUSTRALIA,1868-1873,"Rt. Hon. Sir James Fergusson, Bt.","G.C.S.I., K.C.M.G., C.I.E."
128,SOUTH AUSTRALIA,1873-1877,Sir Anthony Musgrave,K.C.M.G.
129,SOUTH AUSTRALIA,1877-1883,Lieutenant-General Sir William F.D. Jervois,"G.C.M.G., C.B."
130,SOUTH AUSTRALIA,1883-1889,Sir William C.F. Robinson,G.C.M.G.
131,SOUTH AUSTRALIA,1889-1895,Rt. Hon the Earl of Kintore,"K.T., G.C.M.G."
132,SOUTH AUSTRALIA,1895-1899,"Sir T. Fowell Buxton, Bt.",G.C.M.G.
133,SOUTH AUSTRALIA,1899-1902,Rt. Hon. Lord Tennyson,G.C.M.G.
134,SOUTH AUSTRALIA,1903-1909,Sir George R. Le Hunte,G.C.M.G.
135,SOUTH AUSTRALIA,1909-1914,Admiral Sir Day H. Bosanquet,"G.C.V.O., K.C.B."
136,SOUTH AUSTRALIA,1914-1920,Lieutenant-Colonel Sir Henry L. Galway,"K.C.M.G., D.S.O."
137,SOUTH AUSTRALIA,1920-1922,"Lieutenant-Colonel Sir W.E.G. Archibald Weigall, Bt.",K.C.M.G.
138,SOUTH AUSTRALIA,1922-1927,Lieutenant-General Sir G. Tom M. Bridges,"K.C.B., K.C.M.G., D.S.O."
139,SOUTH AUSTRALIA,1928-1934,Brigadier-General Rt. Hon. the Earl of Gowrie,"V.C., G.C.M.G., C.B., D.S.O."
140,SOUTH AUSTRALIA,1934-1939,Major-General Lord Dugan of Victoria,"G.C.M.G., C.B., D.S.O."
141,SOUTH AUSTRALIA,1939-1944,Sir C. Malcolm Barclay-Harvey,K.C.M.G.
142,SOUTH AUSTRALIA,1944-1952,Lieutenant-General Lord Norrie,"G.C.M.G., G.C.V.O., C.B., D.S.O., M.C."
143,SOUTH AUSTRALIA,1953-1960,Air Vice-Marshal Sir Robert A. George,"K.C.M.G., K.C.V.O., K.B.E., C.B., M.C."
144,SOUTH AUSTRALIA,1961-1968,Lieutenant-General Sir Edric M. Bastyan,"K.C.M.G., K.C.V.O., K.B.E., C.B."
145,SOUTH AUSTRALIA,1968-1971,Major-General Sir James W. Harrison,"K.C.M.G., C.B., C.B.E."
146,SOUTH AUSTRALIA,1971-1976,Sir Marcus L.E. Oliphant,K.B.E.
147,SOUTH AUSTRALIA,1976-1977,Sir Douglas R. Nicholls,"K.C.V.O., O.B.E."
148,SOUTH AUSTRALIA,1977-1982,Sir Keith D. Seaman,"K.C.V.O., O.B.E."
149,SOUTH AUSTRALIA,1982-1991,Lieutenant-General Sir Donald B. Dunstan,"K.B.E., C.B."
150,SOUTH AUSTRALIA,1991-1996,Dame Roma F. Mitchell,"D.B.E., C.V.O."
151,SOUTH AUSTRALIA,1996-2001,Sir Eric J. Neal,C.V.O.
152,SOUTH AUSTRALIA,2001-2007,Marjorie Jackson-Nelson,"C.V.O., M.B.E."
153,SOUTH AUSTRALIA,2008-,Rear-Admiral Kevin J. Scarce,
154,TASMANIA (from 1855),1855-1861,Sir Henry E.F. Young,K.C.M.G.
155,TASMANIA (from 1855),1861-1868,Colonel Sir Thomas R. Gore Browne,"K.C.M.G., C.B."
156,TASMANIA (from 1855),1869-1874,Sir Charles Du Cane,K.C.M.G.
157,TASMANIA (from 1855),1875-1880,Sir Frederick A. Weld,G.C.M.G.
158,TASMANIA (from 1855),1881-1886,Major Sir George C. Strahan,K.C.M.G.
159,TASMANIA (from 1855),1887-1893,Sir Robert G.C. Hamilton,K.C.B.
160,TASMANIA (from 1855),1893-1900,Viscount Gormanston,G.C.M.G.
161,TASMANIA (from 1855),1901-1904,Sir Arthur E. Havelock,"G.C.S.I., G.C.M.G., G.C.I.E."
162,TASMANIA (from 1855),1904-1909,Rt. Hon. Lord Strickland,G.C.M.G.
163,TASMANIA (from 1855),1909-1913,Major-General Sir Harry Barron,"K.C.M.G., C.V.O."
164,TASMANIA (from 1855),1913-1917,Sir William G. Ellison-Macartney,K.C.M.G.
165,TASMANIA (from 1855),1917-1920,Sir Francis A.N. Newdegate,G.C.M.G.
166,TASMANIA (from 1855),1920-1922,Sir William L. Allardyce,G.C.M.G.
167,TASMANIA (from 1855),1924-1930,Sir James O’Grady,K.C.M.G.
168,TASMANIA (from 1855),1933-1945,Sir Ernest Clark,"G.C.M.G., K.C.B., C.B.E."
169,TASMANIA (from 1855),1945-1951,Admiral Sir T. Hugh Binney,"K.C.B., K.C.M.G., D.S.O."
170,TASMANIA (from 1855),1951-1958,"Rt. Hon. Sir Ronald H. Cross, Bt.","K.C.M.G., K.C.V.O."
171,TASMANIA (from 1855),1959-1963,Lord Rowallan,"K.T., K.B.E., M.C., T.D."
172,TASMANIA (from 1855),1963-1968,General Sir Charles H. Gairdner,"G.B.E., K.C.M.G., K.C.V.O., C.B."
173,TASMANIA (from 1855),1968-1973,Lieutenant-General Sir Edric M. Bastyan,"K.C.M.G., K.C.V.O., K.B.E., C.B."
174,TASMANIA (from 1855),1973-1982,Sir Stanley C. Burbury,"K.C.M.G., K.C.V.O., K.B.E."
175,TASMANIA (from 1855),1982-1987,Sir James Plimsoll,C.B.E.
176,TASMANIA (from 1855),1987-1995,General Sir Phillip H. Bennett,"K.B.E., D.S.O."
177,TASMANIA (from 1855),1995-2003,Sir Guy S.M. Green,"K.B.E., C.V.O."
178,TASMANIA (from 1855),2003-2004,Richard W. Butler,
179,TASMANIA (from 1855),2004-2008,"William J.E. Cox, E.D.",
180,TASMANIA (from 1855),2008-,Peter G. Underwood,
181,VICTORIA (from 1855),1855,Captain Sir Charles Hotham,K.C.B.
182,VICTORIA (from 1855),1856-1863,Sir Henry Barkly,"G.C.M.G., K.C.B."
183,VICTORIA (from 1855),1863-1866,Sir Charles H. Darling,K.C.B.
184,VICTORIA (from 1855),1866-1873,Viscount Canterbury,"G.C.M.G., K.C.B."
185,VICTORIA (from 1855),1873-1879,Rt. Hon. Sir George F. Bowen,G.C.M.G.
186,VICTORIA (from 1855),1879-1884,Rt. Hon. the Marquess of Normanby,"G.C.B., G.C.M.G."
187,VICTORIA (from 1855),1884-1889,Rt. Hon. Lord Loch,"G.C.B., G.C.M.G."
188,VICTORIA (from 1855),1889-1895,Rt. Hon the Marquess of Linlithgow,"K.T., G.C.M.G., G.C.V.O."
189,VICTORIA (from 1855),1895-1900,Earl Brassey,"G.C.B., T.D."
190,VICTORIA (from 1855),1901-1903,Lord Sydenham of Combe,"G.C.S.I., G.C.M.G., G.C.I.E., G.B.E."
191,VICTORIA (from 1855),1904-1908,Major-General the Hon. Sir Reginald J.A. Talbot,K.C.B.
192,VICTORIA (from 1855),1908-1911,Lord Carmichael,"G.C.S.I., G.C.I.E., K.C.M.G."
193,VICTORIA (from 1855),1911-1913,"Sir John M.F. Fuller, Bt.",K.C.M.G.
194,VICTORIA (from 1855),1914-1920,Lord Sheffield,K.C.M.G.
195,VICTORIA (from 1855),1921-1926,Earl of Stradbroke,"K.C.M.G., C.B., C.V.O., V.D., T.D."
196,VICTORIA (from 1855),1926-1931,Lieutenant-Colonel Lord Somers,"K.C.M.G., D.S.O., M.C."
197,VICTORIA (from 1855),1934-1939,Lord Huntingfield,K.C.M.G.
198,VICTORIA (from 1855),1939-1949,Major-General Lord Dugan of Victoria,"G.C.M.G., C.B., D.S.O."
199,VICTORIA (from 1855),1949-1963,General Sir R.A. Dallas Brooks,"G.C.M.G., K.C.B., K.C.V.O., D.S.O."
200,VICTORIA (from 1855),1963-1974,Major-General Sir Rohan Delacombe,"K.C.M.G., K.C.V.O., K.B.E., C.B., D.S.O."
201,VICTORIA (from 1855),1974-1982,Sir Henry A. Winneke,"K.C.M.G., K.C.V.O., O.B.E."
202,VICTORIA (from 1855),1982-1985,Rear-Admiral Sir Brian S. Murray,K.C.M.G.
203,VICTORIA (from 1855),1986-1992,J. Davis McCaughey,
204,VICTORIA (from 1855),1992-1997,Richard E. McGarvie,
205,VICTORIA (from 1855),1997-2000,Sir James A. Gobbo,C.V.O.
206,VICTORIA (from 1855),2000-2006,John M. Landy,"C.V.O., M.B.E."
207,VICTORIA (from 1855),2006-,David M. de Kretser,
208,WESTERN AUSTRALIA,1848-1855,Captain Charles Fitzgerald,C.B.
209,WESTERN AUSTRALIA,1855-1862,Sir Arthur E. Kennedy,"G.C.M.G., C.B."
210,WESTERN AUSTRALIA,1862-1868,John S. Hampton,
211,WESTERN AUSTRALIA,1868-1869,Sir B.C. Campbell Pine,K.C.M.G.
212,WESTERN AUSTRALIA,1869-1875,Sir Frederick A. Weld,G.C.M.G.
213,WESTERN AUSTRALIA,1875-1877,Sir William C.F. Robinson,G.C.M.G.
214,WESTERN AUSTRALIA,1877-1880,Major-General Sir Harry St.G. Ord,"G.C.M.G., C.B."
215,WESTERN AUSTRALIA,1880-1883,Sir William C.F. Robinson,G.C.M.G.
216,WESTERN AUSTRALIA,1883-1890,Sir Frederick N. Broome,K.C.M.G.
217,WESTERN AUSTRALIA,1890-1895,Sir William C.F. Robinson,G.C.M.G.
218,WESTERN AUSTRALIA,1895-1901,Lieutenant-Colonel Sir Gerard Smith,K.C.M.G.
219,WESTERN AUSTRALIA,1901-1902,Lord Wenlock,"G.C.I.E., K.C.M.G."
220,WESTERN AUSTRALIA,1903-1909,Admiral Sir Frederick G.D. Bedford,K.C.B.
221,WESTERN AUSTRALIA,1909-1913,Rt. Hon. Lord Strickland,G.C.M.G.
222,WESTERN AUSTRALIA,1913-1917,Major-General Sir Harry Barron,"K.C.M.G., C.V.O."
223,WESTERN AUSTRALIA,1917-1920,Sir William G. Ellison-Macartney,K.C.M.G.
224,WESTERN AUSTRALIA,1920-1924,Sir Francis A.N. Newdegate,G.C.M.G.
225,WESTERN AUSTRALIA,1924-1931,Colonel Sir William R. Campion,"K.C.M.G., D.S.O., T.D."
226,WESTERN AUSTRALIA,1948-1951,Sir James Mitchell,G.C.M.G.
227,WESTERN AUSTRALIA,1951-1963,General Sir Charles H. Gairdner,"G.B.E., K.C.M.G., K.C.V.O., C.B."
228,WESTERN AUSTRALIA,1963-1974,Major-General Sir Douglas A. Kendrew,"K.C.M.G., C.B., C.B.E., D.S.O."
229,WESTERN AUSTRALIA,1974-1975,Air Commodore Sir Hughie I. Edwards,"V.C., K.C.M.G., C.B., D.S.O., O.B.E., D.F.C."
230,WESTERN AUSTRALIA,1975-1980,Air Chief Marshal Sir Wallace H. Kyle,"G.C.B., K.C.V.O., C.B.E., D.S.O., D.F.C."
231,WESTERN AUSTRALIA,1980-1983,Rear-Admiral Sir Richard J. Trowbridge,K.C.V.O.
232,WESTERN AUSTRALIA,1984-1989,Gordon S. Reid,
233,WESTERN AUSTRALIA,1990-1993,Sir Francis T.P. Burt,K.C.M.G.
234,WESTERN AUSTRALIA,1993-2000,Major-General P. Michael Jeffrey,"C.V.O., M.C."
235,WESTERN AUSTRALIA,2000-2006,Lieutenant-General John M. Sanderson,
236,WESTERN AUSTRALIA,2006-,Kenneth C. Michael,
237,BAHAMAS (until 1973),1849-1853,John Gregory,
238,BAHAMAS (until 1973),1854-1857,Sir Alexander Bannerman,
239,BAHAMAS (until 1973),1857-1864,Charles J. Bay ley,
240,BAHAMAS (until 1973),1864-1869,Sir Rawson W. Rawson,"K.C.M.G., C.B."
241,BAHAMAS (until 1973),1869-1871,Sir Janies Walker,"K.C.M.G., C.B."
242,BAHAMAS (until 1973),1873-1874,Sir John Pope-Hennessy,K.C.M.G.
243,BAHAMAS (until 1973),1874-1880,Sir William Robinson,G.C.M.G.
244,BAHAMAS (until 1973),1880-1881,Jeremiah T. Fitzgerald Callaghan,C.M.G.
245,BAHAMAS (until 1973),1881-1884,Sir Charles C. Lees,K.C.M.G.
246,BAHAMAS (until 1973),1884-1887,Sir Henry A. Blake,G.C.M.G.
247,BAHAMAS (until 1973),1887-1895,Sir Ambrose Shea,K.C.M.G.
248,BAHAMAS (until 1973),1895-1898,Sir William F.H. Smith,K.C.M.G.
249,BAHAMAS (until 1973),1898-1904,Sir Gilbert T. Carter,K.C.M.G.
250,BAHAMAS (until 1973),1904-1912,Sir William Grey-Wilson,K.C.M.G.
251,BAHAMAS (until 1973),1912-1914,Sir George B. Haddon-Smith,K.C.M.G.
252,BAHAMAS (until 1973),1914-1920,Sir William L. Allardyce,G.C.M.G.
253,BAHAMAS (until 1973),1921-1926,Major Sir Harry E.S. Cordeaux,K.C.M.G.
254,BAHAMAS (until 1973),1926-1931,Major Sir Charles W.J. Orr,K.C.M.G.
255,BAHAMAS (until 1973),1931-1937,Captain the Hon. Sir Bede E.H. Clifford,"G.C.M.G., C.B."
256,BAHAMAS (until 1973),1937-1940,Hon. Sir Charles C. F. Dundas,"K.C.M.G., O.B.E."
257,BAHAMAS (until 1973),1940-1945,Duke of Windsor,"K.G., K.T., K.P., G.C.B., G.C.S.I., G.C.M.G., G.C.I.E., G.C.V.O., G.B.E., M.C."
258,BAHAMAS (until 1973),1945-1949,Sir William L. Murphy,K.C.M.G.
259,BAHAMAS (until 1973),1950,Sir George R. Sandford,"K.B.E., C.M.G."
260,BAHAMAS (until 1973),1950-1953,Major-General Sir Robert A.R. Neville,"K.C.M.G., C.B.E."
261,BAHAMAS (until 1973),1953-1956,Earl of Ranfurly,K.C.M.G.
262,BAHAMAS (until 1973),1957-1960,Sir O. Raynor Arthur,"K.C.M.G., C.V.O."
263,BAHAMAS (until 1973),1960-1964,Sir Robert de S. Stapledon,"K.C.M.G., C.B.E."
264,BAHAMAS (until 1973),1964-1968,Lord Grey of Naunton,"G.C.M.G., G.C.V.O., O.B.E."
265,BAHAMAS (until 1973),1968-1972,Lord Thurlow,K.C.M.G.
266,BAHAMAS (until 1973),1972-1973,Sir John W. Paul,"G.C.M.G., O.B.E., M.C."
267,BAHAMAS (until 1973),1838-1867,Charles R. Nesbitt,
268,BAHAMAS (until 1973),1867-1868,Charles Lempriere,
269,BAHAMAS (until 1973),1868-1873,Major Sir George C. Strahan,K.C.M.G.
270,BAHAMAS (until 1973),1873-1874,John D’A. Dumaresq,
271,BAHAMAS (until 1973),1874-1890,Edward B.A. Taylor,C.M.G.
272,BAHAMAS (until 1973),1890-1894,Sir Henry M. Jackson,G.C.M.G.
273,BAHAMAS (until 1973),1894-1895,Sir George Melville,K.C.M.G.
274,BAHAMAS (until 1973),1895-1905,John K.G.T. Spencer-Churchill,C.M.G.
275,BAHAMAS (until 1973),1905-1918,William M. Hart-Bennett,C.M.G.
276,BAHAMAS (until 1973),1918-1923,Henry E.W. Grant,C.M.G.
277,BAHAMAS (until 1973),1924-1929,Sir Alan C. Burns,G.C.M.G.
278,BAHAMAS (until 1973),1929-1934,Hon. Sir Charles C. F. Dundas,"K.C.M.G., O.B.E."
279,BAHAMAS (until 1973),1935-1940,James H. Jarrett,
280,BAHAMAS (until 1973),1940-1943,William L. Heape,C.M.G.
281,BAHAMAS (until 1973),1943-1955,Charles P. Bethel,O.B.E.
282,BAHAMAS (until 1973),1956-1964,Kenneth M. Walmsley,"C.M.G., O.B.E."
283,BAHAMAS (until 1973),1964-1970,William H. Sweeting,"C.M.G., C.B.E."
284,BAHAMAS (until 1973),1970-1973,Lewis M. Davies,"C.M.G., C.B.E."
285,Colonial Secretary (Deputy Governor from 1969),1838-1867,Charles R. Nesbitt,
286,Colonial Secretary (Deputy Governor from 1969),1867-1868,Charles Lempriere,
287,Colonial Secretary (Deputy Governor from 1969),1868-1873,Major Sir George C. Strahan,K.C.M.G.
288,Colonial Secretary (Deputy Governor from 1969),1873-1874,John D’A. Dumaresq,
289,Colonial Secretary (Deputy Governor from 1969),1874-1890,Edward B.A. Taylor,C.M.G.
290,Colonial Secretary (Deputy Governor from 1969),1890-1894,Sir Henry M. Jackson,G.C.M.G.
291,Colonial Secretary (Deputy Governor from 1969),1894-1895,Sir George Melville,K.C.M.G.
292,Colonial Secretary (Deputy Governor from 1969),1895-1905,John K.G.T. Spencer-Churchill,C.M.G.
293,Colonial Secretary (Deputy Governor from 1969),1905-1918,William M. Hart-Bennett,C.M.G.
294,Colonial Secretary (Deputy Governor from 1969),1918-1923,Henry E.W. Grant,C.M.G.
295,Colonial Secretary (Deputy Governor from 1969),1924-1929,Sir Alan C. Burns,G.C.M.G.
296,Colonial Secretary (Deputy Governor from 1969),1929-1934,Hon. Sir Charles C. F. Dundas,"K.C.M.G., O.B.E."
297,Colonial Secretary (Deputy Governor from 1969),1935-1940,James H. Jarrett,
298,Colonial Secretary (Deputy Governor from 1969),1940-1943,William L. Heape,C.M.G.
299,Colonial Secretary (Deputy Governor from 1969),1943-1955,Charles P. Bethel,O.B.E.
300,Colonial Secretary (Deputy Governor from 1969),1956-1964,Kenneth M. Walmsley,"C.M.G., O.B.E."
301,Colonial Secretary (Deputy Governor from 1969),1964-1970,William H. Sweeting,"C.M.G., C.B.E."
302,Colonial Secretary (Deputy Governor from 1969),1970-1973,Lewis M. Davies,"C.M.G., C.B.E."
303,BARBADOS (until 1966),1848-1856,General Sir William M.G. Colebrooke,C.B.
304,BARBADOS (until 1966),1856-1862,Rt. Hon. Sir Francis Hincks,K.C.M.G.
305,BARBADOS (until 1966),1862-1868,Sir James Walker,"K.C.M.G., C.B."
306,BARBADOS (until 1966),1868-1875,Sir Rawson W. Rawson,"K.C.M.G., C.B."
307,BARBADOS (until 1966),1875-1876,Sir John Pope-Hennessy,K.C.M.G.
308,BARBADOS (until 1966),1876-1880,Major Sir George C. Strahan,K.C.M.G.
309,BARBADOS (until 1966),1880-1885,Sir William Robinson,G.C.M.G.
